달,날짜,기사 제목,감정 수치
한겨레,20170510, 보수 10년  퇴행 바로잡고  미완의 개혁  진전시킬 기회,0
한겨레,20170510, 한겨레 사설  문재인 대통령  국민과 함께  나라다운 나라  만들길,1
한겨레,20170510,미 언론  한국 시민혁명   대북압박 트럼프에 도전 ,0
한겨레,20170510, 한겨레 사설   통합과 공존  앞세운 문 대통령의 취임사,1
한겨레,20170510, 한겨레 사설   이낙연 총리 임종석 실장  인선에 거는 기대,1
한겨레,20170511, 한겨레 사설   비검찰 민정수석  발탁  검찰개혁의 마지막 기회다,1
한겨레,20170511, 한겨레 사설  조속한  한 미 정상회담 으로 한반도 현안 풀어야,1
한겨레,20170511, 한겨레 사설   군림하지 않는 열린 청와대  만들어가길,-1
한겨레,20170512, 한겨레 사설  역사 퇴행 바로잡은 국정교과서 폐지,1
한겨레,20170512, 한겨레 사설  국정농단 재조사  특검이 정답이다,1
한겨레,20170512, 한겨레 사설  비정규직 해결 물꼬 튼  인천공항 1만명 전환 ,-1
한겨레,20170514, 한겨레 사설  민주  새 정부도 꾸리기 전에  떡고물  놓고 다투나,1
한겨레,20170514, 한겨레 사설  대화 기류에 찬물 끼얹는 북한 미사일,-1
한겨레,20170515, 한겨레 사설  유엔도 수정 권고한  한 일 위안부 합의 ,-1
한겨레,20170515, 한겨레 사설  비정규직 난제  노동자의  논의 참여 가 먼저다,1
한겨레,20170515, 한겨레 사설   석탄발전 셧다운 으로 첫발 뗀 미세먼지 30  감축,1
한겨레,20170515, 사설 속으로  한겨레 중앙일보   미국 하원 대북제재법 통과  사설 비교해   ,-1
한겨레,20170516, 한겨레 사설  한 미 정상회담  한반도 위기 해소의 돌파구 열길,-1
한겨레,20170517, 곽병찬 칼럼  이래도 대화냐고  그러니 대화다,-2
한겨레,20170517, 한겨레 사설   재벌개혁 신호탄  올린 김상조 공정위원장 발탁,-1
한겨레,20170517, 한겨레 사설   돈봉투 만찬  감찰  검찰개혁으로 이어져야,0
한겨레,20170517, 한겨레 사설  아직도 진실 다 밝히지 못한 5 18 광주항쟁,0
한겨레,20170517,지금은 검찰 국정원 개혁의 호기다,1
한겨레,20170518, 한겨레 사설   사드  국회 논의  이제 시작할 때다,0
한겨레,20170518, 한겨레 사설  피우진 보훈처장 발탁이 주는 울림,0
한겨레,20170518, 한겨레 사설  오월의 아픔 어루만진 새 대통령의 품격,-1
한겨레,20170518,사드 난제   국회 비준 동의  지렛대로 미 중 설득,0
한겨레,20170519, 한겨레 사설   소신  돋보인 헌재 검찰 인사  개혁 기대 부응하길,1
한겨레,20170519, 한겨레 사설  개헌 추진  국민 뜻 폭넓게 반영해야 성공한다,1
한겨레,20170521, 한겨레 사설  김동연 장하성 경제팀   금수저 흙수저 구조 를 깨라,0
한겨레,20170521, 한겨레 사설   안보 개념  확장한 비군인 출신 안보사령탑,0
한겨레,20170522, 한겨레 사설   4대강 재앙  책임 밝히고 근본 대책 내놓아야,-1
한겨레,20170522, 한겨레 사설   장시간 노동 근절  시급성 일깨운 게임업계 현실,1
한겨레,20170522, 사설 속으로  한겨레 중앙일보   문재인 대통령 취임  사설 비교해보기,-1
한겨레,20170523, 한겨레 사설   상생경영  나선 대기업들의 반가운 움직임,2
한겨레,20170523, 한겨레 사설  봉하마을에서  국민 모두의 정부  다짐한 문 대통령,0
한겨레,20170524, 시민편집인의 눈  문재인 대통령의 리더십과 진보 언론의 길   최영재,0
한겨레,20170524, 한겨레 사설  고위 공직 후보자들의  위장전입  문제,0
한겨레,20170525, 한겨레 사설  인권위 위상 강화  인권국가 발돋움 계기로,-1
한겨레,20170525, 한겨레 사설  검경 수사권 논의  국민 인권 편익 관점서 접근해야,-1
한겨레,20170526, 한겨레 사설  임종석 비서실장의 사과와  국무총리 인준  기준,0
한겨레,20170526, 한겨레 사설  두번 연기한 전시작전권  되도록 빨리 되찾아와야,0
한겨레,20170526, 한겨레 사설   종교인 과세  또 미루자는 김진표 위원장의 몰염치,0
한겨레,20170528, 한겨레 사설  총리 인준 파행   협치의 정신 으로 풀어야,1
한겨레,20170529, 한겨레 사설  가계부채 걱정 다시 키우는  아파트값 상승 ,-2
한겨레,20170529, 한겨레 사설  이제  총리 인준 절차  서둘러야 한다,0
한겨레,20170529, 사설 속으로  한겨레 중앙일보   돈봉투 만찬과 검찰 개혁  사설 비교해보   ,-1
한겨레,20170530, 한겨레 사설  여당 의원 4명 입각  관료사회 혁신 계기 되길,1
한겨레,20170530, 한겨레 사설   사드 추가 반입  의혹  철저히 진상 규명해야,-2
한겨레,20170531, 한겨레 사설  이낙연 총리 인준  협치의 새 출발점 돼야,0
한겨레,20170531, 한겨레 사설  국방부의 사드 보고 누락  고의였다면 책임 물어야,0
한겨레,20170601, 한겨레 사설   여야정 협의체  약속까지 깨버린 자유한국당,1
한겨레,20170601, 한겨레 사설  공무원 증원   공공서비스 확충 이 핵심이다,0
한겨레,20170602, 한겨레 사설  국정원  정치 불개입  약속  법 바꿔 못 뒤집게 해야,-1
한겨레,20170602, 한겨레 사설  과도한 의혹 제기로 끝난  김상조 청문회 ,-1
한겨레,20170604, 한겨레 사설  사드 배치  환경영향평가 이제라도 제대로 해야,-1
한겨레,20170605, 한겨레 사설  안보실 2차장 낙마   검증 강화  계기 삼아야,-1
한겨레,20170605, 한겨레 사설   사드 도입  모든 과정 이 기회에 제대로 점검해야,0
한겨레,20170605, 한겨레 사설  사상 최악의 청년실업과  일자리 추경 ,-2
한겨레,20170605, 사설 속으로  한겨레 중앙일보   고위 공직자 인사 배제 원칙  사설 비교   ,0
한겨레,20170606, 한겨레 사설  보훈의 의미 새롭게 새긴 현충일 추념사,1
한겨레,20170607, 한겨레 사설  검찰농단 진상 밝혀내지 못한  돈봉투 감찰 ,-1
한겨레,20170608, 한겨레 사설  민생 공약 이행 첫 시험대 오른  가계 통신비 인하 ,0
한겨레,20170609, 한겨레 사설  6월항쟁 30돌  진정한  시민권력 시대  열어야,1
한겨레,20170609, 한겨레 사설  고리 1호기뿐 아니라 월성 1호기도 폐쇄해야,-1
한겨레,20170609, 한겨레 사설   사회적 대화  물꼬 튼 민주노총의 일자리위 참여,-1
한겨레,20170611, 한겨레 사설   강경화 낙마  밀어붙이는 국민의당의 착각,-1
한겨레,20170611, 한겨레 사설   가계부채 대책  너무 뜸들이지 말고 내놔야,0
한겨레,20170611, 한겨레 사설  교육 법무장관 후보  파격 넘는 개혁 보여주길,0
한겨레,20170612, 한겨레 사설  양심적 병역거부자  대체복무  도입 서둘러야,-1
한겨레,20170612, 한겨레 사설   일자리 추경  절박성 호소한 대통령의 시정연설,1
한겨레,20170612, 사설 속으로  한겨레 중앙일보   정치인 입각  사설 비교해보기,-1
한겨레,20170612, 한겨레 사설  끝내 무산된 김이수 김상조 청문보고서 채택,0
한겨레,20170613, 한겨레 사설   대법원 혁신  국민요구 반영해 후보 제청해야,0
한겨레,20170613, 한겨레 사설  김상조 공정위원장 임명 불가피했다,1
한겨레,20170613,한 미 29 30일 정상회담  북핵 사드 FTA 포괄 논의할 듯,1
한겨레,20170614, 한겨레 사설  학교현장 개혁과 함께 가야 할  외고 자사고 폐지 ,1
한겨레,20170614, 한겨레 사설  성과연봉제 폐지  임금체계 개편으로 이어져야,0
한겨레,20170614, 장흥배  을의 경제학  연 245조원 복지 재정 확보의 비결,1
한겨레,20170615, 한겨레 사설  안경환 조대엽 후보자 논란에 대해,-1
한겨레,20170615, 한겨레 사설   방송 정상화  틀어막는 적반하장 자유한국당,0
한겨레,20170615, 한겨레 사설  김관홍 잠수사를 기억하며,0
한겨레,20170615, 한겨레 사설  강경화 임명  결국 민심이 중요하다,-1
한겨레,20170616, 한겨레 사설  안경환 후보자의 사퇴  불가피한 선택이었다,0
한겨레,20170618, 한겨레 사설  문정인 특보의  대북 대화  발언 논란,-1
한겨레,20170618, 한겨레 사설   경제 민주주의  칼 빼든  김상조의 공정위 ,1
한겨레,20170618, 한겨레 사설   강경화 임명 으로  협치의 판  깨져선 안 된다,-1
한겨레,20170619, 한겨레 사설   탈핵 국가 로의 대전환  국민 합의가 중요하다,0
한겨레,20170619, 한겨레 사설  6 19 부동산 대책   강남 과열  잡을 수 있겠나,0
한겨레,20170619, 왜냐면   사드 먼저 철거하면 우리도 들어갈게    박수규,0
한겨레,20170619, 사설 속으로  한겨레 중앙일보   현충일 추념사 보훈의 의미  사설 비교해   ,-1
한겨레,20170620, 한겨레 사설  북한   웜비어 사태  진상 밝히고 유족에게 사과하라,0
한겨레,20170620, 한겨레 사설  인사 문제로 민정수석 출석하라는 야당의 과한 주장,1
한겨레,20170621, 한겨레 사설  북핵 문제 해결에 긴요한  한국 역할론 ,-1
한겨레,20170622, 한겨레 사설   블라인드 채용   학벌사회 해소의 첫걸음 되길,-2
한겨레,20170622, 한겨레 사설  송영무 후보자   방산비리 척결  자격 있나,0
한겨레,20170622, 한겨레 사설  국민 기대에 한참 못 미친  통신비 절감 대책 ,-1
한겨레,20170623, 한겨레 사설  국민 용납 않는  위안부 합의   새 정부가 바로잡아야,1
한겨레,20170623, 한겨레 사설  추경 볼모로 국회 파행시키는 자유한국당의 몽니,0
한겨레,20170625, 한겨레 사설  평창 올림픽서  남북 단일팀  꼭 볼 수 있기를,0
한겨레,20170626, 한겨레 사설  이혜훈 대표   개혁적 보수 의 새 길 열기를,0
한겨레,20170626, 한겨레 사설  한 미 정상회담  당당하되 전략적 접근 필요하다,1
한겨레,20170626, 사설 속으로  한겨레 중앙일보   정부의 일자리 추경  사설 비교해보기,-1
한겨레,20170627, 한겨레 사설  국민의당  특검 운운하며 잔꾀 부릴 때인가,1
한겨레,20170628, 한겨레 사설  신고리 원전 시민배심원단  숙의 민주주의  보여주길,0
한겨레,20170628, 시민편집인의 눈   정확한 사실 이 정치와 언론을 구원한다,1
한겨레,20170628, 한겨레 사설  송영무 후보 월 3천만원 자문료  국민 납득하겠나,0
한겨레,20170630, 한겨레 사설  정당한 권리  사회적 총파업   공감대 넓히려면,1
한겨레,20170630, 한겨레 사설  2 만 세금 내는 느슨한 상속세 손질해야,-1
한겨레,20170702, 한겨레 사설  미국의 FTA 때리기  대처 방안 면밀히 준비해야,-1
한겨레,20170702, 한겨레 사설  대통령과 여야  대치정국 풀기 위해 지혜 모으길,1
한겨레,20170702, 한겨레 사설   대북 4노 원칙  바탕으로 북한 문제 주도적으로 풀어야,0
한겨레,20170703, 한겨레 사설  이효성 방통위원장 후보자의 막중한 책임,0
한겨레,20170703, 한겨레 사설  홍준표 대표   막장 보수 서 환골탈태해야,-2
한겨레,20170703, 사설 속으로  한겨레 중앙일보   사법부 블랙리스트 파문  사설 비교해보   ,-1
한겨레,20170704, 한겨레 사설  문무일 후보자  검찰기득권 내려놓을 각오 돼있나,0
한겨레,20170704, 한겨레 사설  원청  산재 책임  강화   위험의 외주화  끊는 계기로,-1
한겨레,20170704, 한겨레 사설  대화 노력에 찬물 끼얹는 북의 무모한 미사일 발사,-2
한겨레,20170705, 한겨레 사설  북 ICBM  강하게 대응하되  주도권  잃지 말아야,1
한겨레,20170705, 한겨레 사설  기관투자가   거수기 노릇  이젠 그만둘 때다,0
한겨레,20170706, 한겨레 사설  여당서도  부적격 의견  나오는 조대엽 후보자,-1
한겨레,20170706, 한겨레 사설  북핵 해결 위한  한 중 협력 강화  바람직하다,-1
한겨레,20170706, 한겨레 사설  문 대통령의  베를린 선언   남북대화로 결실 맺기를,-1
한겨레,20170707, 한겨레 사설  아베 총리  진정성 있게  위안부 문제  사과해야,-1
한겨레,20170709, 한겨레 사설   유서대필 조작  사건 검사들에게 책임 못 묻다니,0
한겨레,20170709, 한겨레 사설   사람 중심 경제  공약   부자 증세  없이는 힘들다,-2
한겨레,20170709, 한겨레 사설  북핵 해법 이견 드러낸 G20  우리가 돌파구 열어야,-1
한겨레,20170710, 한겨레 사설   을 들의 최저임금 갈등   갑 의 고통분담이 먼저다,-1
한겨레,20170710, 한겨레 사설   물타기용 특검  또 들고나온 국민의당의 적반하장,0
한겨레,20170710, 사설 속으로  한겨레 중앙일보   탈원전 정책 논란  사설 비교해보기,-1
한겨레,20170711, 한겨레 사설  대통령과 여야 지도부가 머리 맞대고 해법 찾으라,-1
한겨레,20170712, 한겨레 사설  안철수 전 대표  어떻게 책임지겠다는 것인가,0
한겨레,20170713, 한겨레 사설  조대엽 후보자 사퇴  이젠 국회도 정상화해야,-1
한겨레,20170713, 김종철 칼럼  원전문제  누가 결정해야 하나,-1
한겨레,20170713, 한겨레 사설   통상 사령탑 도 없이 맞게 된 미국의 FTA 공세,0
한겨레,20170716, 한겨레 사설  최저임금 7530원  후속대책이 관건이다,0
한겨레,20170717, 한겨레 사설  홍준표 대표의 너무 속좁은  청와대 회동  거부,0
한겨레,20170717, 한겨레 사설  새 정부의 첫  남북대화  제안  북한도 호응해야,-2
한겨레,20170717, 사설 속으로  한겨레 중앙일보   신베를린 선언과 남북정상회담 제안  사   ,1
한겨레,20170719, 한겨레 사설  대통령과 여야 대표  자주 만나서 대화해야,-2
한겨레,20170719, 한겨레 사설   촛불 정신  담은 국정운영 청사진  문제는 실행이다,1
한겨레,20170721, 한겨레 사설  남쪽의 대화 제안에  메아리 없는 북 ,-1
한겨레,20170721, 한겨레 사설  증세 미루지 말고  공평 과세  실현해야,-1
한겨레,20170723, 한겨레 사설   안전 민생 공무원  증원 축소로 반쪽 돼버린 추경,1
한겨레,20170723, 원전 제로 까지 최소 60년 탈원전  정말 과속일까요 ,0
한겨레,20170723, 한겨레 사설  여성 장관 30    유리천장  깨는 이정표 되길,1
한겨레,20170723, 한겨레 사설  복지 뒷받침할  포괄적 증세  논의 필요하다,0
한겨레,20170724, 한겨레 사설  문무일 후보자  이런 태도로  검찰개혁  할 수 있겠나,0
한겨레,20170724, 사설 속으로  한겨레 중앙일보   내년 최저임금 확정  사설 비교해보기,-1
한겨레,20170725, 한겨레 사설   죽기 전에 일본의 사과 받고 싶다 더니 ,0
한겨레,20170725, 한겨레 사설  새 정부  경제 패러다임 전환   성과로 보여줘야,0
한겨레,20170726, 한겨레 사설  담뱃값 다시 내리자는 자유한국당의  후안무치 ,0
한겨레,20170726, 한겨레 사설   전교조 재합법화  정부 결단 필요하다,-1
한겨레,20170726, 시민편집인의 눈  민주주의는  겸손한 언론 을 원한다   최영재,0
한겨레,20170727, 한겨레 사설   쇄신 인사 로 첫 단추 끼운 검찰  이제 개혁에 나서야,1
한겨레,20170727,북  군사회담 반응도 미사일 발사도 없었다,0
한겨레,20170727, 한겨레 사설  문 대통령과 기업인 첫 만남   상생경제  출발점 돼야,0
한겨레,20170728, 한겨레 사설  한밤  미사일 도발 로 위기 높인 북한의 무모함,-1
한겨레,20170730, 한겨레 사설  사드 추가 배치로 북한 ICBM 막을 수 있나,0
한겨레,20170730, 한겨레 사설  문 대통령의 여름휴가  부정적으로 볼 일 아니다,-2
한겨레,20170730, 한겨레 사설   대륙간탄도미사일  연거푸 발사한 북한의 무모함,0
한겨레,20170731, 한겨레 사설  위기의 한반도   한국 역할  포기 말아야,-1
한겨레,20170731, 사설 속으로  한겨레 중앙일보   문재인 정부 국정운영 5개년 계획  사설   ,1
한겨레,20170801, 한겨레 사설  미국  압박만으론  북 핵 미사일 문제  풀 수 없다,-1
한겨레,20170802, 한겨레 사설  소폭에 그친 증세   지출 구조조정 으로 보완해야,-1
한겨레,20170804,이건 전문가들이 결정할 문제가 아닙니다,1
한겨레,20170806, 한겨레 사설  마침내 외환위기 이전으로 돌아가는 이자상한선,-2
한겨레,20170806, 한겨레 사설  초등교사 임용  내년 늘리고 중장기 수급전망 내야,0
한겨레,20170806, 한겨레 사설  안보리 제재 따른 한반도 위기 대응전략도 세워야,-1
한겨레,20170807, 한겨레 사설   대북 압박 에 치우친 한 미 정상 통화,0
한겨레,20170807, 사설 속으로  한겨레 중앙일보   문무일 검찰총장 후보자 인사청문회  사설   ,0
한겨레,20170808,문 대통령  몰카영상  유포자한테 삭제비용 물려라 ,0
한겨레,20170808, 한겨레 사설   가습기살균제  고통 어루만진 대통령의 사과,-1
한겨레,20170809, 한겨레 사설   공영방송 정상화  가로막는 훼방꾼들,-1
한겨레,20170810, 한겨레 사설  박기영 임명 철회  청와대가 결단해야,-1
한겨레,20170811, 한겨레 사설  한반도 위기   대북 특사 로 돌파구 열어야,-1
한겨레,20170811, 한겨레 사설  1년 반 만에 집값 하락  주택시장 정상화 출발 돼야,0
한겨레,20170813, 한겨레 사설  문 대통령  광복절 경축사에 담대한  북핵 해법  담기를,-1
한겨레,20170813, 한겨레 사설  징벌적 손배제   3배 배상 으로 갑질 근절하겠나,-1
한겨레,20170814, 한겨레 사설  이제라도 독립유공자와 후손 제대로 예우해야,-2
한겨레,20170814, 한겨레 사설   건강보험 보장성 강화  맞춰 실손보험도 대수술을,-1
한겨레,20170814, 사설 속으로  한겨레 중앙일보   초등교사 수급 갈등  사설 비교해보기,-1
한겨레,20170815, 한겨레 사설  문화방송 망가뜨린 장본인들의 적반하장,-1
한겨레,20170815, 한겨레 사설  우리 곁에 닥쳐온  살충제 달걀  충격,-1
한겨레,20170815, 한겨레 사설   전쟁만은 막겠다  평화 의지 천명한 문 대통령,-1
한겨레,20170816, 한겨레 사설  3년여 만의 사과  이제 세월호를  진실 의 바다로,1
한겨레,20170816, 한겨레 사설  누가  건국절  주장하며 분열 부추기는가,-1
한겨레,20170817, 한겨레 사설   나라다운 나라  물꼬 튼 100일  이제부터 시작이다,1
한겨레,20170818, 한겨레 사설  북한에  레드라인  넘지 말라고 경고한 대통령,-1
한겨레,20170818, 한겨레 사설  헌법재판관에  색깔론  이어 이젠  정치색  트집인가,1
한겨레,20170821, 한겨레 사설   살충제 달걀 파동 에 대국민 사과한 대통령,0
한겨레,20170821, 한겨레 사설  대법원장  파격 인선   사법개혁으로 이어져야,0
한겨레,20170821, 사설 속으로  한겨레 중앙일보   2017년 세법개정안  사설 비교해보기,-1
한겨레,20170822, 한겨레 사설  교육부의 수능  양자택일식  결정  재고해야 한다,-1
한겨레,20170822, 한겨레 사설   외교가 우선 이라는 미군 수뇌부  북한도 화답하길,-1
한겨레,20170823, 한겨레 사설  5 18 특별조사  온전한  진상 규명  계기 되길,1
한겨레,20170823, 한겨레 사설  방통위  방송사에  공적 책임  엄격히 물어야,0
한겨레,20170823, 한겨레 사설  사드에 멈춘 25년 한 중 관계   성숙한 동반자  돼야,1
한겨레,20170824, 한겨레 사설  MBC 망쳐놓은 김장겸 사장의 적반하장,0
한겨레,20170824, 한겨레 사설   전쟁 막자는 게 논란이 된다 는 대통령의 탄식,-1
한겨레,20170828, 사설 속으로  한겨레 중앙일보   문 대통령 취임 100일 기자회견  사설 비   ,0
한겨레,20170829, 한겨레 사설  올해만 18번 미사일 쏜 김정은의 무모함,-1
한겨레,20170829, 한겨레 사설  복지 확대하고 SOC 삭감한 문재인 정부 첫 예산,1
한겨레,20170830, 한겨레 사설   독재가 불가피했다 는 박성진 후보자  장관 자격 있나,-1
한겨레,20170830, 시민편집인의 눈  사실관계의 핵심을 파고드는 기사가 아쉽다   최영재,-1
한겨레,20170901, 한겨레 사설   문재인 공산주의자 라는 자가 방문진 이사장이라니,0
한겨레,20170901, 한겨레 사설  이유정 후보 사퇴 계기로  인사 실패  원인 점검해야,-1
한겨레,20170903, 한겨레 사설  김정은   핵이 지켜줄 것 이란 오판 거두라,1
한겨레,20170904, 사설 속으로  한겨레 중앙일보   안철수 국민의당 대표 당선  사설 비교해   ,-1
한겨레,20170904,4월엔  석유 끊는다 던 중국신문  이번엔  과격해선 안된다 ,-1
한겨레,20170905, 한겨레 사설   군사력 강화 만으로 북핵 문제 해결할 수 없다,-2
한겨레,20170906, 한겨레 사설  이민자 청년 내쫓아 지지층 굳히는 비열한 트럼프,-2
한겨레,20170906, 한겨레 사설  신중하게 접근해야 할  소년법 개정  문제,0
한겨레,20170906, 한겨레 사설  안보 위기 와중의  반쪽 국회  더는 안 된다,-1
한겨레,20170907, 한겨레 사설  이런 방식의 사드 배치 강행  옳지 않다,-1
한겨레,20170907,중국과 북핵 공조커녕 더 강한 경제보복 직면할 듯,0
한겨레,20170908, 한겨레 사설  사드 배치  문 대통령이 직접 국민 앞에 설명해야,-1
한겨레,20170908, 한겨레 사설  홍준표 대표의 옹졸한  청와대 회동  거부,-1
한겨레,20170908, 한겨레 사설   포용적 성장이 한국 경제의 길  역설한 IMF 총재,0
한겨레,20170911, 사설 속으로  한겨레 중앙일보   수능 개편 1년 유예  사설 비교해보기,-1
한겨레,20170911, 한겨레 사설  기본권 옹호했다고 김이수 인준 부결한  폭주 국회 ,0
한겨레,20170912, 한겨레 사설  한계 드러낸 유엔 대북결의  결국 협상으로 풀어야,-1
한겨레,20170912, 한겨레 사설   국민의당이 결정권 가졌다 는 안철수 대표의 착각,1
한겨레,20170912, 한겨레 사설  대법원장 후보자마저 정략 대상으로 삼지 말라,1
한겨레,20170913, 박찬수 칼럼   코드  프레임의 허구,0
한겨레,20170913, 한겨레 사설   부적격  박성진 후보자  사퇴 불가피하다,-1
한겨레,20170914, 한겨레 사설  대북 인도적 지원  남북 경색 푸는 계기 되기를,0
한겨레,20170917, 한겨레 사설  자유한국당의  막말 과  생트집 은 어디까지인가,0
한겨레,20170917, 한겨레 사설   압박 대화  병행 기조  국제사회 지지 이끌어내야,-2
한겨레,20170918, 한겨레 사설  김명수 후보자 인준  더이상 미룰 명분 없다,-1
한겨레,20170919, 한겨레 사설   정책 혼선  자초한 송영무 장관의 경솔한 처신,0
한겨레,20170920, 한겨레 사설  김명수 후보자 인준  국회가 합리적 판단 하길,1
한겨레,20170920, 한겨레 사설   평화  내던지고  호전성 만 드러낸 최악의 유엔 연설,-2
한겨레,20170922, 한겨레 사설  트럼프와 달리 30번이나  평화  언급한 문 대통령,-1
한겨레,20170922, 한겨레 사설   촛불 입법  성과 내려면 정책연대 시급하다,0
한겨레,20170922, 한겨레 사설  우려스러운 김정은 트럼프  강대강 대결 ,1
한겨레,20170922,임은정  괴물 잡겠다고 검사 됐는데 우리가 괴물이더라 ,0
한겨레,20170925, 한겨레 사설   안보 위기 에도 청와대 회동 거부하는 자유한국당,-1
한겨레,20170925, 사설 속으로  한겨레 중앙일보   대북 인도적 지원  사설 비교해보기,-1
한겨레,20170926, 한겨레 사설  북 미  선전포고  공방까지  한국이 위기 냉각시켜야,-1
한겨레,20170926, 한겨레 사설  강남 재건축  진흙탕 수주전   언제까지 놔둘 건가,0
한겨레,20170927, 한겨레 사설  공공기관  채용 차별  없앴다더니  거짓말이었나,-2
한겨레,20170927, 시민편집인의 눈  정의로운 보도  좀더 야무지게    최영재,2
한겨레,20170927, 한겨레 사설   전쟁 안된다  강조한 뜻깊은 청와대 합의,1
한겨레,20170928, 한겨레 사설   전시작전권 환수  빠를수록 좋다,1
한겨레,20170928, 한겨레 사설  노 정 모두  사회적 대화  물꼬부터 터라,-1
한겨레,20171001, 한겨레 사설  미국은  북한과 대화채널 있다 는데 한국은 어떤가,-1
한겨레,20171008, 세상 읽기  북핵 위기와 류현진 등판 일정   김누리,0
한겨레,20171008, 한겨레 사설  세계 네번째로  나홀로 자영업자 가 많은 나라,-1
한겨레,20171009, 한겨레 사설  청년빈곤의 핵심  주거문제  대응 서둘러야,0
한겨레,20171009, 사설 속으로  한겨레 중앙일보   김명수 대법원장 인준 가결  사설 비교해   ,-1
