달,날짜,기사 제목,감정 수치
동아일보,20170517, 사설 6월 말 한미 정상회담  노무현  자주파  실패 잊지 말아야,1
동아일보,20170517,200채 미만 아파트  소규모 재건축  쉬워진다,-1
동아일보,20170518, 사설 김상조 공정위  재벌개혁도  시장 틀  벗어나선 안 된다,-1
동아일보,20170518, 사설 北과 대화조건 낮추려는 美  이럴 때  노 라고 말해야,-2
동아일보,20170519, 사설 역대 처음  임기초 개헌  공약 지키겠다는 文대통령,0
동아일보,20170519,왕이  韓中관계 걸림돌 없애달라 ,0
동아일보,20170519, 사설  돈봉투 만찬  검찰의 특수활동비까지 개혁하라,0
동아일보,20170520, 사설 성과연봉제 없애면 철밥통 공공개혁 물 건너갈 것,0
동아일보,20170520, 사설 與野政협의체  대통령 참여해 국정 새 모델 만들라,-1
동아일보,20170520, 사설 憲裁 검찰을  정권 코드 로 바꾸려는 것인가,1
동아일보,20170522, 사설 北  미사일 축포  받은 새 외교안보 라인의 과제,0
동아일보,20170522, 사설 文 경제팀  재벌개혁 집착하다 성장 일자리 놓치지 말아야,0
동아일보,20170523, 사설  4대강 사업은 적폐  결론 내려놓은 감사 공정할까,2
동아일보,20170523, 사설 인수위 없는 組閣 인선  청문회에서 철저 검증해야,-1
동아일보,20170523, 사설 北 잇단  주체탄  도발  대북제재 완화할 때인가,-1
동아일보,20170524, 사설 네 대통령 운명 엇갈린 5월 23일,1
동아일보,20170525, 사설 對北 대화론자로 채운 국가안보실,-1
동아일보,20170525, 사설 이낙연 후보자  책임총리 위상 역할 확고히 하라,0
동아일보,20170525, 사설  일자리 상황판  설치한 文  재벌 점검보다 서비스업 육성을,-1
동아일보,20170526, 사설 국정기획위가  점령군  소리 듣지 않으려면,1
동아일보,20170526, 사설 D―259 평창   매력국가 코리아  브랜드 높일 기회다,0
동아일보,20170526, 사설 홍위병식 文 지지  정권에 짐으로 남을 것,-2
동아일보,20170527, 사설 차질 없는 구조조정 처음 밝힌 국정기획위원회,1
동아일보,20170527, 사설 청와대  인사원칙 위배  사과 유감,-1
동아일보,20170527, 사설 文정부의 첫 對北접촉 승인   북핵 용인  오판은 안 된다,1
동아일보,20170529, 사설 AI 도전 앞에 선 인류   알파고 충격  이후 우린 뭘 했나,-1
동아일보,20170529, 사설 꽉 막힌  1기 내각  출범  與 더 낮추고 野 협조하라,-1
동아일보,20170529, 사설 경총 비판한 대통령  기업을  일자리 동반자  삼아야,-1
동아일보,20170530, 사설  5 18 유죄   통진당 해산 반대   김이수 憲裁소장 적절한가,-2
동아일보,20170530, 사설 서훈 후보  대북협상가에서 안보파수꾼으로 바뀌어야,0
동아일보,20170531, 신문과 놀자  주니어를 위한 사설 따라잡기 평창올림픽 코리아 브랜드 높일    ,0
동아일보,20170531, 사설 文정부서 또 다시 벌어지는  사드 소모전 ,-1
동아일보,20170531, 사설 의원 4명 입각  지역 안배 뛰어넘는  대통합 내각  만들라,0
동아일보,20170531, 사설 불공정 의혹 김상조  공정거래 다잡을 수 있겠나,0
동아일보,20170601, 사설 이낙연 총리  靑권력 견제하고 내각 힘 싣는 책임총리 돼야,0
동아일보,20170601, 사설 이석채 무죄  말 안 들으면 죄인 만들어내는 권력,-1
동아일보,20170602, 단독 김상조 부인 채용 고교  토익 900점을 901점 허위 보고,-1
동아일보,20170602, 사설 네거티브 규제만 지켜도  일자리 100일 계획  성공할 것,1
동아일보,20170602, 사설 의혹 종합세트 김상조 후보 스스로 사퇴해야,-2
동아일보,20170603, 사설 韓美  말로는  대북정책 합의  행동으론 엇박자,1
동아일보,20170603, 사설 건설 중인 신고리 原電 중단해선 안 된다,-1
동아일보,20170605, 사설  치매 국가책임제   모럴해저드 경계하라,-1
동아일보,20170605, 사설  대통령 직속 위원회  수명은 5년인가,0
동아일보,20170605, 사설  분배문제 해결하겠다 는 장하성  성장해법도 내놔야,-1
동아일보,20170606, 사설 靑  사드 조사   결국 남은 4대 배치 중단으로 귀결됐다,0
동아일보,20170606, 사설 부동산 대책  서민 부채폭탄 터지지 않도록 해야,-2
동아일보,20170606, 사설  北과 천안함 진상 조사하자 는 황당한  촛불 청구서 ,-1
동아일보,20170607, 사설  애국은 보수 진보 나눌 수 없다 는 대통령 추념사,-1
동아일보,20170607, 사설 사흘 후 文 취임 한 달  18部 장관 중 12명 이름 안 나왔다,0
동아일보,20170608, 사설 경제부총리 후보  혁신성장  소신을 주목한다,1
동아일보,20170609, 사설 北 또 미사일  사드 환경평가가 국민안위보다 重한가,0
동아일보,20170609, 사설 文 대통령이 재계 만나 일자리 창출 협조 구하라,0
동아일보,20170609, 사설  우병우 라인  물갈이  검찰 줄 세우기 이젠 끝내야,-1
동아일보,20170610, 사설 6월 항쟁 30년   2017년 체제  완성하는 改憲 1년 남았다,1
동아일보,20170610, 사설 英 보수당 과반 실패와 佛 사회당 몰락의 뜻,0
동아일보,20170612, 전승훈 기자의 지금  여기  3 1운동과 임시정부  동아일보 100주년은 하나   ,1
동아일보,20170612, 사설  親文 코드  교육 법무 국방장관  대통합 안 보인다,0
동아일보,20170612, 사설 새 국정 화두  경제 민주주의 는 또 뭔가,-1
동아일보,20170612, 사설 국회 찾는 文대통령  인사난맥 풀려면 진솔한 사과를,0
동아일보,20170613, 사설 논문 표절 김상곤 후보  하향평등 교육으로 가나,0
동아일보,20170613, 사설 문 대통령의 첫 추경연설  일자리 늘려야 성장한다 ,0
동아일보,20170614, 사드 결정 번복땐 주한미군 철수 구실 될수도 ,1
동아일보,20170614, 사설  마이웨이 내각 으로 인사절벽 넘을 수 있겠는가,0
동아일보,20170614, 사설 블랙리스트 뒷북 감사  새 정부는  화이트리스트  유혹 끊어라,1
동아일보,20170614, 사설 北무인기의 사드 촬영  軍  더 뚫려야 정신 차리나,1
동아일보,20170615, 사설 자사고 외고 폐지 교육경쟁력은 포기하는가,-1
동아일보,20170615, 사설 임명 강행하며  국민검증 통과했다 는 靑의 오만,0
동아일보,20170616, 사설 靑  청문회는 참고용   협치 문 닫을 건가,0
동아일보,20170616, 사설 남북정상회담 기대 밝힌 文   북핵 현실  직시하라,2
동아일보,20170617, 사설 안경환 사퇴  조국 靑수석  인사 검증했나  코드 검증 했나,0
동아일보,20170617, 사설 韓美정상회담 앞두고 터진 대북정책 파열음,1
동아일보,20170619, 사설 강경화 임명 강행한 文  더 낮은 자세로 野 설득하라,-1
동아일보,20170620, 사설 6 19부동산대책  풍선효과  못 막으면 서민만 피해 볼 것,-2
동아일보,20170620, 사설 4대그룹 공정위원장 만남  財界 우려 씻는 계기 돼야,1
동아일보,20170620, 사설  이 나라에서 학교 운영하기 싫다   상산고 이사장 격정토로,0
동아일보,20170621, 사설 대학생 죽음에 분노한 美   연내 남북정상회담  기대한 文,-1
동아일보,20170621, 사설 금속노조의  봉이 김선달 식 일자리기금 제안,0
동아일보,20170622, 사설  사회적 총파업  예고한 민노총  어떤 사회를 말하는가,-1
동아일보,20170622, 사설 한미회담 앞둔 美기류  워싱턴 사람들은 바보 아니다 ,-2
동아일보,20170622, 사설 일자리委 첫 회의에서  親기업  밝힌 문 대통령,0
동아일보,20170623, 사설 송영무 국방장관 후보  이렇게 부적격할 수 있나,-1
동아일보,20170624, 사설 법관들  정권바람 탄 싸움 말고 개혁 큰 그림 그려라,0
동아일보,20170624, 사설 한미 회담 직전  美대사관 포위 한다는 사드 반대자들,0
동아일보,20170624, 사설  블라인드 채용  민간도입 법제화  시장경제 맞나,-1
동아일보,20170626, 사설 평창 올림픽 남북단일팀 제안  너무 서두르는 것 아닌가,0
동아일보,20170626, 사설 송영무 국방장관 후보  자진사퇴가 대통령 돕는 길,0
동아일보,20170627, 사설 韓美동맹 미래  文 트럼프 정상회담에 달렸다,1
동아일보,20170627, 사설 바른정당 이혜훈 대표 선출  보수   정풍운동  경쟁하라,2
동아일보,20170628, 사설 시민단체 출신 선호하는 文 인사  국정능력도 보라,2
동아일보,20170628, 사설  청년이라 죄송합니다 ,-2
동아일보,20170628, 사설  문준용 의혹  증거 조작 국민의당  안철수부터 사과해야,-2
동아일보,20170629, 사설 문 대통령  한미동맹 승리의 새 이정표 만들라,2
동아일보,20170629, 사설 原電정책 시민에 떠넘긴 靑   저의  운운하며 입까지 막나,1
동아일보,20170630, 사설 文대통령  韓美는 혈맹    잉크 쏟아진  사드로 얼룩져서야,-1
동아일보,20170630, 사설 민간이 좋은 일자리 만들도록 공공기관은 모범을,2
동아일보,20170701, 사설 정규직 양보 없이 비정규직 해결 요구한 민노총 파업,-1
동아일보,20170701, 사설 정상회담서 한미 FTA 재협상 제기한 트럼프 대통령,1
동아일보,20170703, 사설 트럼프  한국 주도적 역할 지지   역량부터 갖춰야,-1
동아일보,20170703, 사설  문준용 조작  조사 받은 안철수  정치생명 걸 각오 보여라,1
동아일보,20170704, 내 생각은 송하성 1석3조 민간조사원  이제 허용해야 할 때다,-1
동아일보,20170704, 사설  남북관계 운전하겠다 는 文  국제공조보다 과속 말아야,1
동아일보,20170704, 사설 미움보다 무서운 무관심 속에 뽑힌 홍준표 대표,-1
동아일보,20170705, 사설 北  ICBM 성공   격랑의 한반도  패러다임이 바뀌었다,1
동아일보,20170705, 사설 문무일 후보  檢 개혁 최종목표는  정치적 중립 이어야,1
동아일보,20170706, 사설 문 대통령은 누란의 위기 극복할  베를린 선언  내놓아야,-1
동아일보,20170707, 사설 첫 韓中정상회담 엇박자 속에 나온  베를린 구상 ,1
동아일보,20170707,납작 엎드린 전경련 상의  이유는 정반대,0
동아일보,20170708, 사설 사드 보복 계속한다는 시진핑  자유무역 말할 자격 있나,0
동아일보,20170708, 사설 첫 韓日 정상회담   실용적 관계  복원해 북핵 공조 다져야,1
동아일보,20170710, 사설 組閣도 못 끝낸 새 정부 두 달  文  야당 설득 나서라,1
동아일보,20170710, 사설  6 25 이후 최고 위기 라는 문 대통령 인식 변화,-1
동아일보,20170710, 사설 최저임금 1만 원 강행에 협상장 떠난 소상공인,0
동아일보,20170711, 사설 공문 한 장으로 8조 原電공사 중단하라는  행정 만능 ,1
동아일보,20170711, 사설  G19 1 회의   미국이 중심에 없는  G제로 세계  열린다,0
동아일보,20170712, 사설  한반도문제 해결할 힘 없다   文의  뼈저린  국제현실 인식,-2
동아일보,20170713, 사설 文  베를린 구상 에  한미훈련 중단  요구로 간보겠다는 北,0
동아일보,20170713, 사설 제보 조작 사과한 안철수  무엇을 내려놓으려나,0
동아일보,20170714, 사설 송영무 국방 임명하려  조대엽 카드  던졌나,0
동아일보,20170714, 사설  찬반 입장 없다 는 文  原電중단 공약 재고해야,-2
동아일보,20170715, 사설 原電공사 중단 기습의결로 본 한국  소통 不在 ,0
동아일보,20170715, 단독 시진핑  北과 혈맹  말한적 없는데  靑 잘못된 해석으로 혼선,-2
동아일보,20170717, 사설  내년 6월 개헌  文 약속 지킬 수 있나,0
동아일보,20170717, 사설 최고 인상한 최저임금  중기 소상공인 고통 외면할 건가,-1
동아일보,20170718, 사설 남북회담 제의  대북방송 중단 이산가족 연계 안 된다,0
동아일보,20170718, 사설  적폐특위  포기한 靑  反부패협의회는 미래 향한 개혁을,-1
동아일보,20170718, 사설 전경련 불행 언급하며 기업에  알아서 하라 는 공정위원장,-1
동아일보,20170719, 사설  적폐 기관장  지목한 兩 노총  마녀사냥인가,0
동아일보,20170719, 사설 대화할 때 아니라는 美日 한국이 對北공조 균열 내서야,-1
동아일보,20170720, 사설 검찰총장의 反부패협의회 참석 부적절하다,-2
동아일보,20170720, 사설 野의견 경청한 문 대통령  듣는 것으로 끝나선 안돼,0
동아일보,20170720, 사설 새 정부 100대 과제   공약 강박증  떨쳐라,0
동아일보,20170721, 사설 군인생명 담보로 하는 방산비리 사슬 이번에 끊어야,0
동아일보,20170721, 사설  표 걱정에 증세 없이 복지 확대할 수 없다 ,-1
동아일보,20170722, 사설 법인세 인상   핀셋 증세 라지만 경제파장 심각할 것,0
동아일보,20170724, 사설 120명 중 26명 추경 표결 불참  민주  여당 자격 있나,0
동아일보,20170724, 사설 文  원전중단 폐쇄  원자력안전위 권한 침해다,0
동아일보,20170725, 사설 대기업 고소득자 증세에 웬  명예과세   사랑과세 인가,2
동아일보,20170725, 사설 대통령 財界간담회에 오뚜기가 참석하는 까닭,0
동아일보,20170725, 사설 신고리 공론화委   건설중단用 들러리  안 된다,-1
동아일보,20170726, 사설 초유의 경제실험이 될  소득주도 성장  정책,1
동아일보,20170727, 사설 동북아 美中 갈등 격화  對北군사력 키울 기회다,-1
동아일보,20170727, 사설 靑 간담회 앞둔 재계  상생 펀드  발표  이 불편한 느낌은 뭔가,-1
동아일보,20170728, 사설 靑간담회서 나온 재계 건의  규제 풀어야 일자리 나온다 ,0
동아일보,20170728, 사설 초유의 부채 전액 탕감   빚 안 갚아도 되는 사회  만들 텐가,-1
동아일보,20170729, 사설  기업과 정부는 동반자 라는 文  노동편향 인식 바꿔나가길,1
동아일보,20170729, 사설 한 달 새 1억 뛴 강남 집값  부동산 잡으면 피자 쏜다는데,0
동아일보,20170731,北미사일엔 의례적 성명만  한국 사드배치만 때리는 中,-1
동아일보,20170731, 사설 北 2차 ICBM급 발사  김정은 대화 상대 아니다,-2
동아일보,20170731, 사설 사드  더는 논란 대상 안 돼야,1
동아일보,20170731, 사설 50조 원 도시재생사업  재원 시기 규모 적정한가,1
동아일보,20170801, 사설 FTA 사령탑 김현종  美 안보의존 별개로 통상협상하라,0
동아일보,20170801, 사설  선거 왜곡  노린 조작사건  국민의당이 끝이어야,0
동아일보,20170802, 사설 자기 말도 손바닥 뒤집듯 하는 국방장관,0
동아일보,20170802, 사설 위기의 트럼프  행동  나선다면 韓美채널 작동할까,-1
동아일보,20170807, 사설 백악관 안보사령탑이 입에 올린  한반도 예방전쟁 ,1
동아일보,20170808, 사설 韓美日  최대 압박    천백 배 보복  불사한다는 北,0
동아일보,20170808,왕이 발언 키워드로 본 中의 사드 속내,0
동아일보,20170808, 사설 4강 대사 인선  지금 해도 늦다,-2
동아일보,20170809, 사설 군 파격 인사  개혁목표는 첫째도 둘째도 强軍이어야,0
동아일보,20170809, 사설 문무일 개혁안  검찰개혁 무마용은 안 된다,0
동아일보,20170810, 사설 對北결의안 하나 없이 정쟁에 매몰된 정치권,1
동아일보,20170810, 사설 건강보험  비급여 완전해소   국민부담 설득할 수 있나,-2
동아일보,20170811, 사설 수능 절대평가하려면 대학에 선발자율권 許하라,0
동아일보,20170811, 사설 괌 포격 계획 밝힌 北  정부   컨틴전시 플랜 도 준비해야,-1
동아일보,20170811, 사설 수능 절대평가하려면 대학에 선발자율권 許하라,0
동아일보,20170812, 사설 檢  정치적 중립 이라 쓰는데  알아서 기라 로 읽힌다면,1
동아일보,20170812, 사설  美 보복 놔두겠다 는 中  김정은   고립과 자멸  택할 건가,1
동아일보,20170814, 사설 시진핑  美 北 양비론  위기 키울 뿐이다,-1
동아일보,20170814, 사설  전자파 괴담  거짓 확인된 사드  추가 배치 서둘러야,-1
동아일보,20170815, 사설 공무원 임금 놔두고 私기업 월급 공개한다는 정부,1
동아일보,20170815, 사설 64년 지켜온 韓美동맹 주춧돌은 신뢰다,1
동아일보,20170816, 사설  불안한 평화  아닌  당당한 평화  이뤄내야,-2
동아일보,20170817, 사설 文정부  속도전 100일   개혁조급증 떨쳐야 성공할 것,2
동아일보,20170818, 사설 개헌  권력분산 없으면 불행한 대통령史반복될 것,-2
동아일보,20170818, 사설  美대북옵션 한국 동의 약속   文 트럼프 핫라인 구축해야,-1
동아일보,20170819, 사설  정치 세무조사  악습  이제부터 사라질까,1
동아일보,20170819, 사설 백악관서 나온 주한미군 철수론  美 부인해도 안도 말라,-1
동아일보,20170821, 사설 의사 부족 외상센터 지속가능하지 않다,-1
동아일보,20170822, 사설  파격  김명수 후보  사법부 독립과 개혁 적임자인가,-1
동아일보,20170822, 사설 살충제 계란 사태  다른 먹거리 안전도 재점검하라,1
동아일보,20170822, 사설 文  직접민주주의  강조  代議制 헌법정신 어긋난다,1
동아일보,20170823, 사설 美軍  한반도 톱3  군복 입고 김정은에 경고하다,1
동아일보,20170824, 사설 트럼프  김정은  우리 존중  北 美대화 신호탄인가,0
동아일보,20170825, 사설 수교 25년  중국 치졸한 사드 보복 그만두라,0
동아일보,20170825, 사설 장관도 위원장도 노총 출신  기울어진  노사정 운동장 ,2
동아일보,20170826, 사설 이케아는 빼고 국내쇼핑몰만 쉬라는 역차별 규제,0
동아일보,20170826, 사설 교육계 현안 널렸는데 김상곤 사회부총리 어디 갔나,0
동아일보,20170828, 사설  안철수 대표 도 국민의당도 마지막 기회,0
동아일보,20170828, 사설 東 발사체 西 백령도 점령 훈련  北  전략 도발  아니고 뭔가,0
동아일보,20170829, 사설 비리 의혹 덩어리 이유정 후보  지명 철회해야,-1
동아일보,20170829, 사설 숨죽이는 기업  경제단체라도 할 말 하라,-1
동아일보,20170829, 사설 전작권 전환  軍역량 넘어 서두르면 盧정부 실패 반복될 것,1
동아일보,20170830, 사설 日영공 통과 北미사일에  안보 불안  드러낸 3시간,-1
동아일보,20170830, 사설 슈퍼 복지예산 429조  성장 없이 지속가능한가,0
동아일보,20170831, 사설 文 아베  극한의 압력   中  송유관 잠가 北 끌어내라,0
동아일보,20170831, 사설 北核 모르고 주재국 인맥 없는 美 中 日대사로 위기 넘겠나,-1
동아일보,20170901, 사설 현장 곳곳서 부적합성 드러낸  비정규직 제로  선언,1
동아일보,20170902, 사설 靑  코드 색안경 으로 검증의 눈 가렸나,0
동아일보,20170904, 사설 트럼프의  한미 FTA 폐기  압박  이 판에 동맹 흔드나,0
동아일보,20170904, 사설  한반도 비핵화 의 終焉  대북전략 완전히 새로 짜라,-1
동아일보,20170904, 사설 文정부 첫 정기국회  본연의 견제기능 되찾아야,1
동아일보,20170905, 사설 문 대통령  韓美균열 메우고  對北 포위외교  펼쳐라,0
동아일보,20170906, 사설 시진핑 푸틴   김정은 폭력정권  끝까지 감쌀 건가,-1
동아일보,20170907, 사설 北核 해결 없이 동북아 經協한다는 푸틴의 착각,-1
동아일보,20170908, 사설  김정은  박은 첫 유엔 제재안  총력외교로 관철시켜라,1
동아일보,20170908, 사설 기억하고 되풀이 말아야 할  사드 국력 소모전 ,0
동아일보,20170909, 사설 문 대통령  여야대표와 머리 맞대 국민 안심시켜야,1
동아일보,20170911, 사설 재외공관을  자신의 왕국 으로 만드는 외교관 특권의식,1
동아일보,20170911, 사설 미국發 전술핵 재배치론  우리도 이대로 있을 순 없다,-1
동아일보,20170912, 사설 헌재소장 첫 인준 부결  文정부 겸허하라는 民意 경고다,1
동아일보,20170912, 사설 法檢 갈등  국민 신뢰 잃으면 둘 다 패배자,0
동아일보,20170913, 사설 대통령의 對北 우회전  핸들 잡아채는 사람들 누군가,0
동아일보,20170913, 사설 박성진 장관 후보  정직성 전문성 다 문제다,1
동아일보,20170914, 사설 대법원장 인준   사법부 독립  최우선 가치로 판단하라,-1
동아일보,20170914, 사설 대법원장 인준   사법부 독립  최우선 가치로 판단하라,-1
동아일보,20170915, 사설 美  북핵 돈줄 묶을  세컨더리 보이콧  압박해야,-1
동아일보,20170915, 사설 김동연 부총리  말보다 행동으로 소신 관철하라,0
동아일보,20170916, 사설  北 재기불능 만들 힘 있다 는 文  이젠 행동으로 보여야,0
동아일보,20170918, 사설 유엔 데뷔 문 대통령  북핵제재  선명한 메시지를,1
동아일보,20170919, 사설  치매극복의 날 에 맞춘 설익은 치매대책,0
동아일보,20170919, 사설  슈퍼 검찰  공수처 권한남용은 누가 통제하나,-1
동아일보,20170920, 사설 트럼프  김정은 정권 완전히 파괴하겠다 ,-1
동아일보,20170921, 사설 문 대통령  트럼프 능가하는 현실주의로 무장하라,0
동아일보,20170922, 사설 새 대법원장  이념대결 넘어선 국민의 사법부 만들어야,0
동아일보,20170922, 사설 증인 마구 부르는  국감 적폐  청산하라,0
동아일보,20170922, 사설  평화  30차례 강조한 문 대통령의 유엔 연설,-1
동아일보,20170923, 사설 美 김정은 위험한 대결  비상한 각오로 대비해야,-2
동아일보,20170923, 사설 직접고용 밀어붙이는 고용부  가맹업 공멸 원하나,0
동아일보,20170925, 사설 도시재생 성공 열쇠는 民 官 소통,1
동아일보,20170926, 사설 日 언론  책임 있는 한국 관련 보도를,0
동아일보,20170927, 사설 美폭격기에 뻥 뚫린 北   힘의 한계 를 공갈로 숨길 순 없다,-2
동아일보,20170928, 사설 안보엔 與野 左右 없이 한목소리 내야 할 때다,0
동아일보,20170928, 사설  선진국 중 드물게 10년간 하락했다 는 한국 경쟁력,0
동아일보,20170929, 사설 문정인 대통령특보  더는 들어줄 수가 없다,0
동아일보,20171008, 사설 갈 데까지 간 北  이젠 개성공단  도둑 가동 까지 하나,1
동아일보,20171010, 사설 세계 유례없는 국감 기형적 행태 되풀이 말라,0
동아일보,20171011,25일째 무력도발 없는 김정은  北내부 단속 바쁜 탓 ,1
동아일보,20171011, 사설 軍 官 民  불의의 사태  대비돼 있나,0
동아일보,20171012, 사설  혁신성장  멀리 있지 않다  규제부터 풀라,1
동아일보,20171012, 사설 강정마을 구상권 철회로 법치도 혈세도 포기할 건가,0
동아일보,20171013, 사설 공기업 지역인재 30  일률적 할당은 역차별,0
동아일보,20171013, 사설 現 안보역량에 전작권 전환 서두르면 北 쾌재 부를 것,0
동아일보,20171014, 사설  20년 과거털기  文정부 첫 국감  잃는 것은 미래다,1
동아일보,20171016, 사설 문 대통령  새 헌재소장 후보 내는 것이 헌법정신에 맞다,1
동아일보,20171018, 사설 文  국빈방문 트럼프와  친구 되면 코리아 패싱 사라질 것,1
동아일보,20171019, 사설 47일 만에 재판관 지명  소장은 9개월 공석인 비정상 憲裁,1
동아일보,20171019, 사설 新산업 사회적 기업 키워 일자리 위기 넘어서라,-1
동아일보,20171021, 사설 文 대선공약 거둬들인 시민참여단의  신고리 건설 재개 ,0
동아일보,20171023, 사설 신고리 입장 발표한 文  국익 위한  공약 철회  주저 말라,0
동아일보,20171024, 사설 르노삼성車 사장의 토로  일손 달려도 채용 겁난다 ,-1
동아일보,20171024, 사설 인도적 지원 끊어 강한 對北경고 보낸 국제사회,0
동아일보,20171025, 사설  복합 처방  아쉬운 10 24 가계부채 대책,1
동아일보,20171025, 사설 공론조사 만능 아니라는 신고리 공론화위원장,-1
동아일보,20171025, 사설 민노총의 오만과 독선  도를 넘었다,-1
동아일보,20171026, 사설 차라리 로비스트 양성화해 전관예우 근절하라,-2
동아일보,20171027, 사설 트럼프 DMZ 방문 자체가 超강력 대북 메시지,0
동아일보,20171028, 사설 공동체 좀먹는 亡國病 공공기관 채용비리,0
동아일보,20171028, 사설 촛불 1년  이제 과거에서 미래로 눈을 돌리자,0
동아일보,20171030, 사설 폭력 사라진 시위  시민불편도 없게 업그레이드를,-2
동아일보,20171030, 사설 韓美국방  전작권 성급한 전환에 제동 걸었다,-1
