달,날짜,기사 제목,감정 수치
국민일보,20170518, 사설  민노총 시대착오적 행태에서 벗어나야,0
국민일보,20170518, 사설  제37주년 5 18   아픔 딛고 국민 화합 원년 삼자,-2
국민일보,20170519,왕이  한 중 관계  사드 걸림돌  없애달라 ,0
국민일보,20170519, 사설  공기업 성과연봉제 절차 지켜 계속하라,0
국민일보,20170519, 사설  파격 인사로 시작된 검찰 개혁,0
국민일보,20170519, 사설  여 야 정 국정상설협의체  협치 구심점 돼야,1
국민일보,20170521, 사설  새 경제부총리 일자리 창출 양극화 해소 해법 내놔야,-2
국민일보,20170521, 사설  문재인式 실용인사  고인 물 씻어내는 계기 되길,0
국민일보,20170521, 사설  철저한 후보자 자질 검증은 국회 의무다,1
국민일보,20170522, 사설  북한의 미사일 도발에도 남북교류 시동 건 정부,1
국민일보,20170522, 사설  국정기획委  정권 아닌 국민 위한 청사진 만들어야,1
국민일보,20170522, 사설  4대강 감사  잘못 시정하되 정치보복으로 흘러선 안돼,1
국민일보,20170523, 사설  문 대통령처럼 이제 노무현 전 대통령을 놓아주자,0
국민일보,20170524, 사설  동성애자 장교 유죄 선고 옳은 결정이다,-1
국민일보,20170524, 사설  일자리 숫자만 챙기지 말고 환경을 만들어라,0
국민일보,20170524, 사설  5대 비리 관련자 공직 배제 공약 가급적 지켜야,0
국민일보,20170525, 사설  3無 청와대 수석보좌관 회의  알맹이도 풍성해야,-1
국민일보,20170526, 사설   국민 눈높이 못 맞춘 인사  공식사과한 청와대,0
국민일보,20170526, 사설  남북관계 정상화 추진하되 서두르지 말라,0
국민일보,20170528, 사설  종교인 과세 보완책 꼼꼼히 마련해야,-1
국민일보,20170528, 사설  정부 재계 대립보다 소통이 우선,1
국민일보,20170528, 사설  고위 공직자 인사 검증에 관한 세부 기준 필요하다,0
국민일보,20170529, 사설  부실 검증 사과하지 않고 양해 당부한 문 대통령,-2
국민일보,20170529, 사설  국정원 개혁  기능 약화보다 통제를 강화해야,-2
국민일보,20170529, 사설  새 정부  김정은 의도 제대로 파악하고 있나,0
국민일보,20170530, 사설  논란 휩싸인 김상조 후보  공정위원장 자격 있나,1
국민일보,20170530, 사설  치매 부모 살해하는 비극 끊어야 한다,-2
국민일보,20170530, 사설  국회의원 겸직 장관 후보자들도 제대로 검증해야,-1
국민일보,20170531, 사설  이낙연  대독총리 아닌 책임총리 역할 다해야,-2
국민일보,20170531, 사설  사드 보고누락 엄중하지만 대놓고 조사할 일인가,0
국민일보,20170601, 사설  정규직 전환 추진  기업 상황과 업종 특성 고려해야,-1
국민일보,20170601, 사설  사드 논란 조기에 매듭짓는 게 바람직하다,1
국민일보,20170601, 사설  대통령의 느닷없는 가야사 연구 복원 지시,0
국민일보,20170602, 사설  脫원전 성급하게 밀어붙이지 말라는 경고,-1
국민일보,20170604, 사설  한국당  무조건 반대만 하는 게 야당 역할 아니다,-1
국민일보,20170604, 사설  업무보고 마무리한 국정기획委가 명심해야 할 것들,-1
국민일보,20170605, 사설  총리가 촛불혁명 끝나지 않았다고 하면 ,0
국민일보,20170605, 사설  가계대출 방치해선 소득주도 성장 어렵다,-2
국민일보,20170606, 사설  애국에는 보수 진보 없다는 文 대통령의 추념사,-1
국민일보,20170606, 사설  애국에는 보수 진보 없다는 文 대통령의 추념사,-1
국민일보,20170606, 사설  국회 청문회  개인 흠집보다 능력을 따져보라,1
국민일보,20170607, 사설  감사원의  사드 직무감찰 도 실시하겠다는 청와대,1
국민일보,20170607, 사설   돈봉투 만찬  징계  검찰 특권 내려놓는 계기 돼야,1
국민일보,20170608, 사설  호평과 우려를 동시에 받은 文 대통령의 집권 한 달,0
국민일보,20170608, 사설  정부와 재계  노동 현안 놓고 치열하게 토론하라,1
국민일보,20170609, 사설  휴대전화 기본료 언제까지 부과할 건가,-1
국민일보,20170609, 사설  여권  문자폭탄 근절에 적극 나서야,1
국민일보,20170609, 사설  사드 배치 보류에 한 미동맹 언급한 미국,0
국민일보,20170611, 사설  사법개혁 시대적 요구이나 정권이 주도해선 안 돼,-1
국민일보,20170611, 사설  사법개혁 시대적 요구이나 정권이 주도해선 안 돼,-1
국민일보,20170612, 사설  일자리 통한 성장론이 실효 거두려면,0
국민일보,20170612, 사설  인사 난국 정면 돌파 의지 내비친 대통령,1
국민일보,20170612,최민희  지라시 유포자 처벌 요구,-1
국민일보,20170613, 사설  방한한 섀넌  한 미 정상회담 사전조율 빈틈 없어야,1
국민일보,20170613, 사설  이번엔 기재부 2차관 임명 철회하라는 노동단체,0
국민일보,20170613, 사설  장관 후보자 도덕성은 안 보겠다는 건가,1
국민일보,20170614, 트럼프  사드 문제로 文 대통령 너무 압박 말아야 ,0
국민일보,20170614, 사설  협치 시동도 걸기 전에 야당과 등 돌린 청와대,0
국민일보,20170614, 사설  새 정부의 교육정책  디테일이 중요하다,1
국민일보,20170615, 사설  北  핵 미사일 도발 멈추고 文 대통령 대화제의 응해야,-2
국민일보,20170615, 사설  최저임금 1만원보다 후폭풍 진정책이 먼저다,1
국민일보,20170616, 사설  너무 부실한 인사검증  이유는 뭐고 대책은 있나,0
국민일보,20170618, 사설  강 장관 임명 강행 후폭풍  문 대통령이 나서라,0
국민일보,20170618, 사설  타이밍도 방법도 우려되는 문 특보 발언,0
국민일보,20170618, 사설  선심성 정책 밀어붙이는 국정위  쓴 약도 필요하다,0
국민일보,20170619, 사설  정의용 국가안보실장 제 역할 다하고 있나,1
국민일보,20170619, 사설  脫원전  정교한 로드맵 마련 우선돼야,1
국민일보,20170619, 사설  6 19 대책 효과 거두려면 장기적 주택정책 필요하다,1
국민일보,20170620, 사설  조국 민정수석  국회에 출석 못할 이유 없다,0
국민일보,20170620, 사설  웜비어 죽음으로 재확인된 김정은 정권의 잔학성,0
국민일보,20170621, 사설  노동계 지금이 줄파업 운운할 때인가,1
국민일보,20170621, 사설  문 대통령의 북핵 2단계 해법 넘어야 할 산 많다,0
국민일보,20170622, 사설  휴대전화 기본료 폐지 공약하지나 말지,-1
국민일보,20170622, 사설  한국당은 추경 심사 참여하고  조국은 국회 출석해야,-1
국민일보,20170623, 사설  공정위원장과 재벌의 만남이 의미 있으려면,-1
국민일보,20170623, 사설  정당 돈줄 살리는 법안 처리에 찰떡공조한 정치권,1
국민일보,20170623, 사설  민주노총의 과도한 정부 압박 볼썽사납다,0
국민일보,20170625, 사설  문재인 트럼프 신뢰 구축이 정상회담 최우선 과제다,2
국민일보,20170626, 사설  구조화된 프랜차이즈  갑질  이번 기회에 뿌리 뽑자,1
국민일보,20170626, 사설  이혜훈 신임 대표  제대로 된 보수정당 만들어야,1
국민일보,20170626, 사설  한 미 동맹 다지는데 주력하라는 前주미대사들의 조언,0
국민일보,20170627, 사설   황혼 자살  부추기는 노인빈곤 대책 시급하다,-1
국민일보,20170627, 사설  국민의당과 안철수 후보는 증거조작 몰랐나,0
국민일보,20170627, 사설  국회 정상화 합의됐지만 세 후보 해법이 관건,-1
국민일보,20170628, 사설  정당한 의혹 제기도 개혁 저항세력 음모인가,-1
국민일보,20170628, 사설  외고 자사고 폐지 논란 공론의 場부터 만들라,0
국민일보,20170629, 사설  충격적인  백남기 보고서   경찰 스스로 진상 밝혀라,-1
국민일보,20170629, 사설   한 미동맹은 피로 맺어졌다 고 강조한 문 대통령,-1
국민일보,20170630, 사설   부자증세  시동 건 새 정부 조세정책,1
국민일보,20170630, 사설  한 미동맹 선언적 의미 넘어 실천적 조치 있어야,0
국민일보,20170701, 文 대통령  사드 철회 않고 北과 대화에 신중  공은 트럼프에 넘어갔다     ,-1
국민일보,20170702, 사설  방위비 분담금 증액 요구  원칙 갖고 당당히 대응하길,0
국민일보,20170702, 사설  한 미 FTA  트럼프 전술에 끌려가지 말아야,0
국민일보,20170703, 사설  노무현정부의 철도개혁도 뒤집으려는 문재인정부,1
국민일보,20170703, 사설  홍준표 체제 출범  보수 재건될 수 있을까,0
국민일보,20170704, 사설  열기 고조되는 종교개혁 500주년  나부터  캠페인,0
국민일보,20170704, 사설  北  ICBM 성공 주장  중대 위기에 처한 한반도 안보,1
국민일보,20170704, 사설  문무일 검찰총장 후보자의 과제,0
국민일보,20170705, 사설  김상곤  균형감 있는 교육정책 펴기를,1
국민일보,20170705, 사설  김정은이 감내하지 못할 수준의 제재와 압박밖에 없다,0
국민일보,20170706, 사설  뉴베를린 선언 기조 유지하되 현실감 있는 전략 써야,0
국민일보,20170706, 사설  관계 회복 가능성 확인한 한 중 정상회담,1
국민일보,20170707, 사설  국회까지 멈춰 세운 秋 대표의 돌출 발언,1
국민일보,20170707, 사설  한 미 일의 대북 제재 방안 구체화시켜야,-1
국민일보,20170707, 사설  애플 인텔 제치고 세계 1위 올라선 삼성전자,0
국민일보,20170709, 사설  이준서 영장 청구로 최대 위기 맞은 국민의당,-1
국민일보,20170709, 사설  文 대통령  국내 정치권 갈등 직접 풀어야,1
국민일보,20170710, 사설  청와대와 여당이 꼬인 정국 해법 제시하라,-1
국민일보,20170710, 사설  밀어붙이기식  脫원전 으로 갈등 부추겨서야,-1
국민일보,20170711, 사설  트리플 위기인데 파업하겠다는 자동차 노조,-1
국민일보,20170712, 사설  안철수  어떻게 책임지겠다는 건지가 안 보인다,0
국민일보,20170713, 사설  한수원 이사회 무산  원전 정책 재검토하라,1
국민일보,20170713, 사설  한 미 FTA 재협상 공식화됐는데 통상 사령탑이 없다,-2
국민일보,20170713, 사설  송 장관  국방개혁 제대로 수행할 수 있을까,1
국민일보,20170714, 사설  영수회담 통해 정국 정상화 전기 마련하기를,-1
국민일보,20170714, 사설  한수원  비밀 이사회   탈원전 정당성 확보 어렵다,-1
국민일보,20170716, 사설  대폭 오른 최저임금 7530원 후폭풍 최소화해야,-2
국민일보,20170716, 사설  방산비리 척결  지금이 마지막 기회다,0
국민일보,20170717, 사설  洪 대표의 납득하기 어려운 처신,-1
국민일보,20170717, 사설  남북관계 개선 모색하되 조급하게 굴어선 안 돼,0
국민일보,20170718, 사설  공공기관 낙하산 적폐도 이참에 청산하라,0
국민일보,20170718, 사설  취지 벗어난 특수활동비 모두 없애야,1
국민일보,20170718, 사설  남북 대화 제의  미국과 사전 조율 없었나,-1
국민일보,20170719, 사설  독립된 사정기관 反부패협의회 참여 온당한가,-1
국민일보,20170719, 사설  대통령과 여야 대표 회동 일회성으로 끝나선 안 돼,0
국민일보,20170719, 사설  국정운영 5개년 계획  실현 가능성이 관건이다,1
국민일보,20170720, 사설  시동 걸린 정규직 전환  유념할 점 많다,2
국민일보,20170720, 사설  최저임금 인상 속도조절 언급한 문 대통령,0
국민일보,20170721, 사설  남북 군사회담 조기 성사에 매달릴 필요 없다,-1
국민일보,20170721, 사설  부자증세 공식화  재정전략 치밀하게 짜라,0
국민일보,20170723, 사설  지방의원 자질 논란 자초한 충북도의원들,1
국민일보,20170723, 사설  與도 野도 모두 패자라는 지적 새겨들어야,0
국민일보,20170723, 사설  문무일 후보자 검찰개혁 의지 있나,0
국민일보,20170724, 사설  문 대통령  기업들 얘기 경청하기를,1
국민일보,20170724, 사설  원전 공론화委  구색 갖추는 들러리여선 안 돼,-1
국민일보,20170725, 사설  소득 주도 성장이 실효 거두려면,1
국민일보,20170725, 사설  한국軍 미사일의 탄두 중량 조속히 늘려야,0
국민일보,20170726, 사설  은행권  금융위원장 질책 무겁게 받아들여야,-1
국민일보,20170726, 사설  北  미사일 추가 도발하면 엄청난 후과 치를 것,0
국민일보,20170727, 사설  빚 전액 탕감  모럴해저드 유발 않도록 유념해야,-2
국민일보,20170728, 사설  대통령은 규제 풀고  기업은 고용 확대를,0
국민일보,20170728, 사설  사드 배치 시급하다던 입장 뒤집은 국방부,-1
국민일보,20170730, 사설  서울 아파트값 최고 상승 더 정교한 대책 세워라,1
국민일보,20170730, 사설  레드라인 넘은 김정은  대북정책 전면 재검토해야,-1
국민일보,20170731, 사설  문 대통령이 직접 성주군민 설득해야,-1
국민일보,20170731, 사설  국민의당  제보조작  사과로 끝낼 일 아니다,-2
국민일보,20170731, 사설   공포의 균형  없이는 김정은의 광기 막을 수 없다,-1
국민일보,20170801, 사설  美 中간 북핵 거래론까지   코리아 패싱  경계한다,0
국민일보,20170801, 사설  5년은 전기요금 인상 없다는 정부 여당 무책임하다,-2
국민일보,20170803, 사설  정부 여당 부동산 급등 남 탓 할 때인가,1
국민일보,20170803, 사설  당대표 출마한 안철수  자신의 말에 책임져야,0
국민일보,20170804, 사설  근시안적 교사 수급 실패가 부른 임용 절벽,0
국민일보,20170806, 사설  수능 절대평가 확대  모든 가능성 열어놓고 논의해야,-1
국민일보,20170807, 사설  한 미 일 공조 더 견고하게 다질 때다,0
국민일보,20170808, 사설  문무일 총장의 셀프 개혁안 미덥지 못하다,-2
국민일보,20170809, 사설  한반도 위기 더 이상 증폭시키지 말아야,-1
국민일보,20170810, 사설  북핵 리스크 커지는데 사드 배치조차 못하는 정부,1
국민일보,20170810, 사설  이번 수능 개편안도 문제투성이다,2
국민일보,20170811, 사설  대통령의 핵심정책토의가 의미 있으려면,1
국민일보,20170813, 사설  청와대  박기영 인사 파문에 무거운 책임 느껴야,1
국민일보,20170814, 사설  文 대통령  단호한 대북 메시지 내놓을 때다,0
국민일보,20170814, 사설  이런 경찰에 수사권 맡겨도 되겠나,0
국민일보,20170814, 사설  한국판 리쇼어링 정책도 내놔라,1
국민일보,20170815, 사설  노골적 협박에도 대북 결기 빠진 광복절 경축사,-1
국민일보,20170816, 사설  세월호 유족 만나 사과하고 위로한 문 대통령,0
국민일보,20170817, 사설  문 대통령 기자회견 내용 구체화에 힘쓸 때,-1
국민일보,20170818, 사설  한 미 FTA 개정 협상  의제부터 선점하라,1
국민일보,20170820, 사설  생색내기에 그친 휴대전화 요금 인하 대선공약,-1
국민일보,20170821, 사설   파격  김명수 대법원장 후보자에 대한 기대와 우려,1
국민일보,20170821, 사설  이벤트 행사보단 국정 내실 다져 나가야,1
국민일보,20170821, 사설  수능 공청회 마무리  시안과 시간에 얽매이지 마라,0
국민일보,20170823, 사설  文정부마저  낙하산 적폐  논란에 휩싸이다니,1
국민일보,20170823, 사설  정치권  사법부 독립 위협하는 발언 중단하라,-2
국민일보,20170824, 사설  씁쓸한 한 중 수교 25주년  위기 넘어 미래로,-1
국민일보,20170827, 사설  북한의 저강도 도발 중요하지 않다는 정부 인식,0
국민일보,20170827, 사설  안철수   실력있는 야당  약속 반드시 지켜야,0
국민일보,20170827, 사설  사는 집 빼고 팔라더니 청와대 절반이 다주택자,0
국민일보,20170828, 사설  청와대  대통령 일정 공개 약속 지켜라,1
국민일보,20170828, 사설  기간제 교사 정규직화 갈등 정부 책임 크다,0
국민일보,20170829, 사설  김정은 압박할 비상계획 마련할 때,-1
국민일보,20170831, 사설  수능 개편 1년 유예  단순 공정한 대입제도 만들어라,1
국민일보,20170831, 사설  조명균 장관 개성공단 재개 발언에 불만 표시한 미국,1
국민일보,20170901, 사설  靑 인사 추천 검증시스템 이대론 안 된다,0
국민일보,20170901, 사설  전술핵 둘러싼 정부의 우려스러운 엇박자,1
국민일보,20170903, 사설  MBC 사장 체포 나선 정부  국회 보이콧 선언한 한국당,1
국민일보,20170903, 사설  북한 6차 핵실험 도발  대북정책 새로 짜라,1
국민일보,20170904, 사설  청와대와 여당의 대북 인식 여전히 안이하다,0
국민일보,20170905, 한국 때리기 에 역풍 맞는 트럼프  美언론 일제히 비난,-1
국민일보,20170905, 사설  공시족 양산하는 사회 희망이 없다,0
국민일보,20170905, 사설  중 러의 대북 원유공급 중단에 외교력 집중해야,-1
국민일보,20170906, 사설  자유한국당  국회 복귀가 마땅하다,0
국민일보,20170906, 사설  한 러 정상회담에서 초강경 대북 제재 반대한 푸틴,1
국민일보,20170907, 사설  북핵 공조와 미래지향적 관계 발전 다짐한 한 일 정상,1
국민일보,20170907, 사설  더 과감한 규제개혁 필요하다,0
국민일보,20170910, 사설  정기국회  안보 경제 위기 초당적 극복 계기돼야,0
국민일보,20170910, 사설  아이들 볼모로 집단휴업하겠다는 사립 유치원,0
국민일보,20170911, 사설  전술핵 재배치 논의 꾸물거릴 때인가,0
국민일보,20170911, 사설  갈등만 부추기고 끝난 기간제 교사 정규직화 논란,-1
국민일보,20170911, 사설  소통과 협치 중요성 새삼 일깨운 김이수 부결 사태,1
국민일보,20170913, 사설  청년취업 18년 만에 최악  일자리 상황판 보고 있나,-1
국민일보,20170913, 사설  한국당  새로운 보수의 길 개척 나설 때다,1
국민일보,20170913, 사설  잇단 고위공직자 낙마에도 책임지는 이는 없다,-1
국민일보,20170914, 사설  시장 현실 감안한 경제부총리 발언에 귀 기울여야,0
국민일보,20170914, 사설  대통령 지지율 하락세가 말하는 것,-1
국민일보,20170915, 사설  김정은 숨통 죌 수 있는 모든 방안 검토하라,1
국민일보,20170917, 사설  문 대통령 유엔에서 강력한 대북 압박 주도해야,-1
국민일보,20170918, 사설  치매국가책임제 지속가능한 제도로 뿌리내려야,0
국민일보,20170919, 사설  문정인 이어 송영무도  옐로카드   靑 책임 통감해야,-1
국민일보,20170921, 사설  김명수 동의안 가결  국민 위한 사법 구현 약속 지켜야,0
국민일보,20170921, 사설  미국 일본과 결이 다른 文 대통령의 유엔 연설,0
국민일보,20170922, 사설  청와대  진정성 갖고 협치 실천해야,-1
국민일보,20170924, 사설  격화되는 진영 논리 이대론 안 된다,-1
국민일보,20170925, 사설  고용부의  양대 지침  폐기  노동개혁 출발점 돼야,0
국민일보,20170925, 사설  민주당 사드대책특위 즉각 해체해야,-1
국민일보,20170926, 사설  부정부패 척결  보수정권 손보기로 흘러선 안 돼,0
국민일보,20170926, 사설  혁신 성장 이끌 4차산업혁명위에 힘 실어줘라,1
국민일보,20170927, 사설  4년째 국가경쟁력 26위에 정체된 한국,1
국민일보,20170927, 사설  복지정책 성공하려면 눈먼 돈부터 막아야,2
국민일보,20170927, 사설  안보 문제만큼은 여야가 협력 모색해야,-1
국민일보,20170929, 사설  한국만 경제 나빠지는 이유는 뭔가,0
국민일보,20171001, 사설  안팎의 위기에도 정쟁에 빠진 정치권,0
국민일보,20171010, 사설  국감  과거 아닌 현재와 미래 논의하는 장이어야,0
국민일보,20171011, 사설  맥없이 끝난 KAI 수사  이래서 방산비리 척결되겠나,-1
국민일보,20171011, 사설  혁신성장 속도 내는 것 반갑지만,1
국민일보,20171012, 사설  개헌안 마련에 초당적 협력을,0
국민일보,20171012,이용호  미제와 힘의 균형 막바지  불벼락으로 담판 요구 ,0
국민일보,20171013, 사설  혁신과 인적 쇄신 없으면 보수 통합 무의미하다,0
국민일보,20171013, 사설  한 중 통화스와프 연장  사드 갈등 출구 돼야,-1
국민일보,20171015, 사설  청와대는 새 헌재소장 지명하고 국회는 임기 정리해야,-1
국민일보,20171015, 사설  시작부터 실망스런 국감  뻔한 싸움 당장 그만두라,-2
국민일보,20171016, 사설  박 전 대통령과 변호인  법정에서 결백 입증해야,-1
국민일보,20171017, 사설  헌법재판관 입장 왜곡한 청와대 참모 누구인가,0
국민일보,20171017, 사설  근로시간 단축하되 기업 충격 고려하라,1
국민일보,20171017, 사설  한 미  공통 해법 통해 김정은에 일치된 힘 보여줘야,-1
국민일보,20171018, 사설  일자리 정책 5년 로드맵이 성공하려면,2
국민일보,20171019, 사설  권력기관들에 대한 감사 강화해야,-1
국민일보,20171020, 사설  혁신 없는 보수통합 무의미하다,0
국민일보,20171022, 사설  공론조사 의미있지만 정치 책임성 강화가 먼저다,-2
국민일보,20171022, 사설  1년 만에 다시 태극기와 촛불로 갈라진 나라,0
국민일보,20171023, 사설  만연한 공공기관 채용비리 이번엔 뿌리 뽑아라,0
국민일보,20171023, 사설  개헌 길 튼 아베  악화된 외교환경에 냉철한 대응을,-1
국민일보,20171024, 사설  탈원전 로드맵 국민적 공감대 더 확보해야,-2
국민일보,20171024, 사설  대통령의 대화 제의마저 거부한 민주노총,-1
국민일보,20171025, 사설  공공기관 낙하산 적폐 되풀이해서는 안 된다,-1
국민일보,20171026, 사설  야권  이러고도 문재인 정권 견제할 수 있겠나,1
국민일보,20171026, 사설  지방분권  자율성은 높이고 책임성은 강화해야,-2
국민일보,20171027, 사설  한미 국방장관이 강조한 신뢰가 동맹 근간이다,1
국민일보,20171030, 사설  한국당의 성과 없는 국회 복귀  전략이 안 보인다,0
국민일보,20171031, 사설  올해도  낙제점  국감  제도개선 필요하다,0
국민일보,20171101, 사설  문 대통령 시정연설 설득 협력 위한 전환점 돼야,1
국민일보,20171101,태도 바뀐 中 매체들  사드 합의 양국 공동이익에 부합 ,1
국민일보,20171102, 사설  자사고 우선선발권 폐지  일반고 경쟁력 강화로 이어져야,-1
국민일보,20171102, 사설  재벌  셀프 개혁방안 서둘러 내놔야,-1
국민일보,20171103, 사설  국민연금 이사장까지 캠프 인사인가,0
국민일보,20171105, 사설  시험대 선 한국 외교  철저하고 빈틈없이 대응하라,1
국민일보,20171106, 사설  명분 없는 바른정당 의원들의 한국당 복당 선언,2
국민일보,20171106, 사설  조국 민정수석은 국민 앞에 할 말 없나,1
국민일보,20171107, 사설  예상 뛰어넘는 합의 도출한 한 미 정상  숙제도 남겼다,1
국민일보,20171107, 사설  검찰  살아 있는 권력은 더 철저히 수사하라,0
국민일보,20171108, 사설  문재인케어로 9년 후 건강보험 재정 고갈된다는 경고,1
국민일보,20171108, 사설  미 첨단무기 도입  적극적이고 주도적으로 임해야,-1
국민일보,20171108, 사설  힘을 통한 평화 강조한 트럼프  北  추가 도발땐 자멸뿐,-1
국민일보,20171109, 사설  일자리 안정자금 꼼꼼이 보완해야,0
국민일보,20171110, 사설  비리 의혹 전병헌 수석은 거취 결단해야,-2
국민일보,20171110, 사설  정부의  인도 태평양  전략 혼선 걱정스럽다,-1
국민일보,20171112, 사설  미국과 중국 사이에 낀 한국 외교  제대로 가고 있나,1
국민일보,20171112, 사설   적폐청산이 감정풀이라는 의심이 든다 는 MB,0
국민일보,20171113, 사설  방송법 개정으로 방송장악 논란 종지부 찍어야,1
국민일보,20171114, 사설  민심과 거꾸로 가는 당청의 홍종학 구하기,0
국민일보,20171115, 사설  정부  北 인권 문제 해결에 적극 나서라,0
국민일보,20171117, 사설  몰아치는 정치인 수사  검찰발 사정정국 경계한다,1
국민일보,20171119, 사설  계속 나빠지는 한국인 삶의 질,0
국민일보,20171119, 사설  몰아치는 검찰 수사에도 공수처 논의 주저함 없어야 한다,0
국민일보,20171120, 사설  반쪽짜리 매뉴얼로 수능 무사히 치를 수 있겠나,1
