달,날짜,기사 제목,감정 수치
경향신문,20170818, 사설 남북 간 레드라인은 없다  소모적 논쟁 그만해야,-2
경향신문,20170820, 사설 이유정 후보자  청문회도 안 열고 사퇴하라는 야권,1
경향신문,20170821, 사설 일방적 국정홍보의 마당 펼친 대국민 보고대회,1
경향신문,20170821, 사설 농가는 속이고 정부는 DDT 은폐 의혹  누굴 믿어야 하나,-1
경향신문,20170821, 사설 김명수 대법원장 후보 지명  사법개혁을 기대한다,1
경향신문,20170822, 사설 죽음의 작업장 마다할 수 없는 하청업체의 열악한 현실,-2
경향신문,20170822, 사설 시민 대변은 않고 기독교 기득권만 대변하는 김진표,-1
경향신문,20170822, 사설 통신비 인하 공약  결국 유야무야로 끝났다,0
경향신문,20170823, 사설 기념행사 따로 치른 한 중 수교 25주년의 현실,0
경향신문,20170823, 사설 이 총리는 즉각 식약처장 해임 건의하라,-1
경향신문,20170824, 사설 수능개편안 미루고  대입 제도 근본을 손질해야 한다,0
경향신문,20170827, 사설 돌아온 안철수 대표 앞에 놓인 산적한 과제,0
경향신문,20170827, 사설 문 대통령의 방송법 개혁안 재검토 바람직하지 않다,-1
경향신문,20170828, 사설 문재인 정부 첫 정기국회  개혁입법이 우선이다,1
경향신문,20170828, 사설 KBS 고대영 사장  기자들의 제작거부를 지켜만 볼 건가,0
경향신문,20170829, 사설 국정개혁 의지 담은 내년 예산안  보완책도 필요하다,1
경향신문,20170829, 사설 북한의 미사일 도발과 한 미의 맞대응  지겨운 반복 끝내자,0
경향신문,20170830, 사설 국정원으로 나라 망친 원세훈에 내려진 심판,1
경향신문,20170830, 사설 외교위기에 경제학자 주미대사가 최선일까,-1
경향신문,20170830, 사설  뉴라이트 사관  중기벤처부 장관 후보 지명 철회해야 한다,-1
경향신문,20170831, 사설 미국과 전술핵 배치 논의한 송 국방의 위험한 역주행,-2
경향신문,20170901, 사설 적임자도 못 찾고 검증도 부실  인사 실패 왜 반복되나,0
경향신문,20170903, 정희진의 낯선 사이  베스트 청원 이라는 슬픈 광기,-1
경향신문,20170903, 사설 북한 6차 핵실험 강행  김정은의 광기를 규탄한다,1
경향신문,20170904, 사설 안보위기 때는 여야 없는 초당적 협력이 필요하다,-1
경향신문,20170905, 사설 전술핵 미사일 탄두중량 해제가 북핵 해법인가,-1
경향신문,20170905, 사설 정의당 이 대표의 평화를 위한 5대 제안 주목한다,-1
경향신문,20170906, 사설 양국 협력의 필요성과 한계를 확인한 한 러 정상회담,1
경향신문,20170907, 사설 처벌 강화에 앞서 청소년 이렇게 만든 사회를 성찰하라,-2
경향신문,20170907, 사설 전략 부재로 중심 잃더니 기어코 사드 배치 강행한 정부,1
경향신문,20170908, 사설 한국 경제에 미칠 사드 악영향 막을 대책이 시급하다,-1
경향신문,20170910, 사설 보이콧 철회 자유한국당 이젠 국회에서 제대로 하라,1
경향신문,20170910, 사설 다시 꿈틀대는 부동산시장  보유세 강화해야,-2
경향신문,20170910, 사설 불신받는 외교안보 정책 신뢰회복 조치 필요하다,0
경향신문,20170911, 사설 헌재소장 임명 막은 야당의 정략적 행태와 청와대의 자세,1
경향신문,20170911, 사설 창조과학 극우이념 박성진 후보  국무위원 자격 없다,-1
경향신문,20170913, 사설 박근혜 친박 탈당한다고 한국당 혁신되지 않아,0
경향신문,20170913, 사설 부동산을 향한 욕망  반포1단지 재건축의 경우,-1
경향신문,20170914, 사설 대통령이 당당히 나와 사과하고 바로잡아야,0
경향신문,20170915, 사설 또 미사일 도발한 북한  제재만 반복하는 국제사회,0
경향신문,20170915, 사설 대통령 대신한 비서실장 사과에도 남는 것들,0
경향신문,20170915, 서의동의 사람 사이 서경식  일본 진보진영의 실패로 아베 정권  우향우    ,-1
경향신문,20170917, 사설 김 대법원장 후보는 사법개혁 적임자  반대할 이유 없다,-1
경향신문,20170918, 사설 한국 망신시키는 한국당의 핵무장 1000만 서명운동,-1
경향신문,20170918, 사설 국민의당의 김 대법원장 후보자 표결  똑똑히 지켜보겠다,0
경향신문,20170918, 사설 공수처 신설안  여야 합의로 통과시켜야 한다,0
경향신문,20170919, 수사 대상 오른 이명박 MB식 비판세력 적출법  박근혜 정부보다 저열하고 집   ,1
경향신문,20170920, 사설 북핵 대응 위해 핵잠수함 도입한다니  황당한 발상이다,-2
경향신문,20170921, 사설 여권은 야당 협력에 대한 간절함 잊지 말아야,0
경향신문,20170922, 사설 5당 대표 회동 거부한 홍준표  제1야당 반납하라,0
경향신문,20170922, 사설 김정은 트럼프 대결은 심화되고 평화론은 공허하고,-1
경향신문,20170924, 사설 한반도 위기에 여야 대표가 만나 한목소리 낼 수 없나,-1
경향신문,20170925, 사설 노동자 옥죈 양대 지침 폐기  노사정위 복원 계기 돼야,1
경향신문,20170925, 사설 한국 뺀 미 전략폭격기 단독 작전  두 번 다시 없어야 한다,-1
경향신문,20170927, 사설 대북 특사 고려할 만하다,0
경향신문,20170927, 사설 대통령 여야 대표의  초당적 안보 대처  합의를 환영한다,0
경향신문,20170928, 사설 충격적인 이명박 정부의 적폐 실상,0
경향신문,20171009, 사설 검찰 군이 홍준표 비서 통신조회한 것 사실인가,0
경향신문,20171010, 사설 군내 기강해이 안전 소홀이 빚은 병사의 죽음,-2
경향신문,20171010,노동당 창건일  도발보다 체제 결속 나선 북,0
경향신문,20171011, 사설 미 의회조사국의 북 미 핫라인 제안  검토해볼 만하다,-2
경향신문,20171011, 사설 18만건 고쳤다는 학교생활기록부 신뢰할 수 있나,2
경향신문,20171011, 사설 4차산업이 혁신성장의 엔진이 되기 위한 조건,1
경향신문,20171015, 사설 명분 없이 정치공학만 난무하는 보수 통합논의,1
경향신문,20171016, 사설 공수처장 국회 임명 타당하지만  기능 축소는 재고해야,-1
경향신문,20171017, 사설 내달 초 트럼프 방한  북핵 평화적 해결책 찾는 계기로,-2
경향신문,20171017, 사설 문 대통령은 헌재 소장 지명하고 국회는 입법 나서라,0
경향신문,20171018, 사설 특수고용노동자의 노조 설립 허용  입법으로 뒷받침해야,-1
경향신문,20171019, 사설 여론조사로 통합할 정당 고르는 국민의당,1
경향신문,20171019, 사설 신고리 숙의 결과 무엇이든 탈원전의 길 계속 가야,-1
경향신문,20171020, 사설 신고리 공사 재개하되 탈원전 흔들림 없이 실천해야,-1
경향신문,20171022, 사설 아베 정권의 개헌선 확보가 일본 한국에 드리운 그림자,1
경향신문,20171024, 사설 대통령 간담회에 불참한 민주노총의 이해할 수 없는 태도,-1
경향신문,20171027, 사설 촛불혁명 1년   촛불은 계속된다 ,0
경향신문,20171029, 사설 헌재법 개정으로 헌재 소장 임기 문제 신속히 풀어라,1
경향신문,20171031, 사설 한 중관계 정상화를 넘어 동북아 평화의 길로,-1
경향신문,20171101, 사설 국회는 선거제도개혁이라도 이뤄내야 한다,0
경향신문,20171102, 사설 자사고 외고 우선선발제 폐지  공교육 정상화의 길이다,0
경향신문,20171102, 사설  재벌 스스로 개혁 에 의구심 있다면 공정위가 나서야,-1
경향신문,20171103, 사설 트럼프 방한  전쟁 막고 평화의 길 여는 전환점 돼야,-1
경향신문,20171105, 사설 한국은 미국 풀도 중국 풀도 뜯어먹어야 산다,0
경향신문,20171106, 사설 미 일동맹 강화가 한반도에 퍼뜨리는 불안,-2
경향신문,20171106, 사설 나라 밖에서도 반문만 외치는 안타까운 안철수,1
경향신문,20171107, 사설 청와대 수석 전 비서관 비리 철저히 규명해야,-1
경향신문,20171107, 사설 한 미 정상  몇 가지 우려 해소했지만 북핵 해법은 없었다,0
경향신문,20171107, 사설  한 미 FTA는 미국에 좋은 협상 아니었다 는 트럼프,1
경향신문,20171108, 사설 트럼프의 국회 연설이 남긴 숙제들,0
경향신문,20171108, 사설 국정원 정치개입 수사를 흔드는 불순한 목소리,1
경향신문,20171108, 사설 우리은행장 선임  관치 탈피 약속 지켜야,-1
경향신문,20171109, 사설 갈등 피한 미 중  이젠 북핵 문제 진전시킬 대안 모색을,0
경향신문,20171110, 사설 홍종학 후보  언행 불일치 있지만 장관 부적격 아니다,-2
경향신문,20171112, 사설 자신이 저지른 적폐 성찰 않고 청산작업 비판한 이명박,-1
경향신문,20171112, 사설 자신이 저지른 적폐 성찰 않고 청산작업 비판한 이명박,-1
경향신문,20171113, 사설 전병헌 정무수석  사퇴하고 검찰 조사 받는 게 순리,-1
경향신문,20171117, 사설 한국당  천재지변까지 정략에 이용하나,1
경향신문,20171117, 사설 두 명의 국정원장 구속이 의미하는 것,1
경향신문,20171119, 사설 세월호 미수습자를 가슴에 묻으며 다짐해야 할 것,-2
경향신문,20171122, 사설 새 공직 검증기준  바람직하지만 과제도 남겼다,0
경향신문,20171123, 사설 세월호 미수습자 유골 은폐  있을 수 없는 일이다,0
경향신문,20171126, 사설 김관진 임관빈 잇단 석방  기로에 선 적폐청산 수사,0
경향신문,20171126, 사설 낙태죄 손질  전향적으로 검토할 때다,-2
경향신문,20171126, 사설 주권침해 논란까지 부르는 중국의 사드 압박,-1
경향신문,20171127, 사설 고교학점제 시범 운영  부작용 최소화 방안 마련해야,-2
경향신문,20171128, 사설 여야 협력으로 예산안 시한 내 처리 못할 이유 없다,-1
경향신문,20171128, 사설 허울뿐인 종교인 과세  조세정의에 반한다,1
경향신문,20171129, 사설 100만호 공공주택 계획이 성공하기 위한 조건,1
경향신문,20171130, 사설 한국  평화올림픽 위해 적극적 역할로 전환하라,-2
경향신문,20171201, 사설 이 판에 왜 군사작전 않느냐고 따지는 홍준표,0
경향신문,20171201, 사설 황찬현 감사원장이 지키지 못한 중립성,1
경향신문,20171201,대북 압박 입맞춘 한 미 평창이  대화로 가는 길  열까,-1
경향신문,20171203, 사설 국민연금의 적극적 의결권 행사를 환영함,1
경향신문,20171203, 사설 낚싯배 대형사고  안전불감증 없었나,1
경향신문,20171203, 사설 낚싯배 대형사고  안전불감증 없었나,1
경향신문,20171204, 하태훈의 법과 사회  정의의 지주 여야 할 사면,1
경향신문,20171204, 사설 문재인 정부 첫 예산 합의 다행이지만 과제도 남겼다,1
경향신문,20171204, 사설 보편적 아동수당 지급 취지 훼손  유감스럽다,-2
경향신문,20171206, 사설 북핵 대화 전기 마련하는 한 중 정상회담 돼야,0
경향신문,20171207, 사설 검경 수사권 조정  기본권 보장이 핵심이다,1
경향신문,20171208, 사설 이제는 민생 개혁 입법에 속도 내야 한다,0
경향신문,20171208, 사설 북핵 동맹 평창 올림픽에 대한 미국의 이상한 시선,-1
경향신문,20171211, 사설 구동존이의 지혜가 필요한 한 중 정상회담,2
경향신문,20171212, 사설 김성태 한국당 새 원내대표에 바란다,0
경향신문,20171214, 사설 한 중 정상은 사드를 넘어 협력 강화해야,-1
경향신문,20171214, 사설 중국 측 경호원의 한국 기자 폭행 묵과할 수 없다,-1
경향신문,20171214, 한 중 정상회담  출입 제지  항의에 멱살 잡고 발로 얼굴 강타,1
경향신문,20171215, 사설 한 중 정상회담에 대한 야당의 분별력 잃은 비방,0
경향신문,20171217, 사설 사드 문제 딛고 실리를 향해 한발 내디딘 한 중,-1
경향신문,20171217, 사설 약사의 편의점 판매약 확대 반발  명분 없다,-1
경향신문,20171218, 사설 서로를 무시하는 한 일관계 이대로 좋은가,1
경향신문,20171220, 사설 안철수의 통합 제안  비전 없는 정치공학이다,1
경향신문,20171221, 사설 경제 정의를 훼손한 트럼프의 부자 감세,1
경향신문,20171224, 사설 한국당의 개헌특위 연장 거부  방탄국회 위해서인가,-1
경향신문,20171225, 사설  반사회적 발언 일삼는 홍준표는 정치 지도자인가,1
경향신문,20171226, 사설  88만원에서 77만원세대로 전락한 청년의 현실,0
경향신문,20171226, 사설 여성 일자리 로드맵이 실효성을 높이려면,0
경향신문,20171227, 사설 위안부 합의  이렇게 졸속에 엉터리였다니,-1
경향신문,20171228,  위안부 합의  보고서 후폭풍 아베  1㎜도 움직이지 않을 것 ,0
경향신문,20171229, 사설 검증한다며 고노 담화 훼손한 아베  역지사지해야,-2
경향신문,20171229, 사설 김명환 새 민주노총 위원장에게 바란다,0
경향신문,20180101, 사설 여야는 선거제도 개편에 집중하라,0
경향신문,20180101, 사설 문 대통령의  삶의 질 우선  위한 과제들,0
경향신문,20180101, 사설 김정은의 남북대화 신년사를 환영한다,-1
경향신문,20180102, 사설 남북고위급 회담 성사로 단절의 시대 끝내야,0
경향신문,20180102, 사설 새해에 더 나빠진 야당의 정쟁과 구태,-2
경향신문,20180103, 사설 남북관계 개선의 첫 신호 보낸 북 조평통,1
경향신문,20180103, 사설 홍준표와 다름없는 유승민의 낡은 안보관,-1
경향신문,20180104, 사설 27년 만에 청와대 초청받은 위안부 피해자,-2
경향신문,20180105, 사설 평화의 문 여는 남북 고위급 회담을 기대한다,-1
경향신문,20180105, 사설 트럼프  남북대화를 북 미대화의 입구로 삼아야,-2
경향신문,20180107, 사설 ILO 핵심협약 비준  전교조 법외노조 처분부터 바꾸자,0
경향신문,20180107, 하승수의 틈 개헌  대통령 결단만 남았다,0
경향신문,20180108, 사설 강남 아파트값 급등  보유세 강화 서둘러야,-2
경향신문,20180109, 사설 위안부 합의 깨지 않았지만 일본 면책 아니다,-1
경향신문,20180109, 사설 남북 고위급회담  대화의 힘을 증명했다,-1
경향신문,20180110, 사설 최악의 실업률  한국 사회의 루저가 된 청년들,-2
경향신문,20180110, 사설 비핵화 조급증 버리고 남북신뢰를 쌓아야,-1
경향신문,20180110, 사설 산적한 과제 절감케 한 대통령 신년 기자회견,0
경향신문,20180112, 사설 가상화폐 투기에 내몰린 2030세대의 현실,-1
경향신문,20180114, 사설 민주화의 완성을 위한 국정원 검찰 경찰 개혁,0
경향신문,20180115, 사설 북한 여종업원 집단 탈북  강요 있었는지 확인해야,-2
경향신문,20180116, 사설  유치원 영어 금지  유예  김상곤 교육부가 불안하다,-2
경향신문,20180118, 사설 안철수 유승민 통합선언이 놓치고 있는 것들,0
경향신문,20180118, 사설 이명박 비리는 비리일 뿐 진보 보수 갈등 아니다,-1
경향신문,20180119, 사설 대통령과 양대 노총 만남  노사정 대화 복원만 남았다,-1
경향신문,20180121, 사설 북 사전점검단 방남 취소 해프닝  흔들린 건 남한 내부였다,-1
경향신문,20180122, 사설 KBS 고 사장 해임은 국민의 방송 위한 첫 신호,-1
경향신문,20180122, 사설 홍준표의 신년사  소음과 잡음뿐이다,-1
경향신문,20180122, 액티브X 공인인증  독점 끝 금융 공공기관 전자서명 대체,-1
경향신문,20180124, 사설 문 대통령의 협치  빈말로 끝나지 않아야,0
경향신문,20180124, 역사와 현실 한국인의 짐,-1
경향신문,20180125, 사설 반도체의 놀라운 실적이 부각시킨 한국 경제의 그늘,1
경향신문,20180125, 사설 인터넷 여론 조작과 네이버의 실시간 검색어 전쟁,0
경향신문,20180126, 사설 문 대통령 지지율 최저가 의미하는 것,0
경향신문,20180126, 사설 이번엔 밀양 세종병원  이런 참사 언제 끝날 것인가,-1
경향신문,20180129, 사설 평화올림픽을 위한 미국과 북한의 자세,-1
경향신문,20180131, 사설 우려스러운 빅터 차 내정 철회와 트럼프 국정연설,1
경향신문,20180201, 사설 한화큐셀의 신선한 노동 문제 접근법,-1
경향신문,20180201, 사설 김성태 원내대표의  18세 투표 허용 을 환영한다,0
경향신문,20180202, 사설 남북화해와 평화의 의미를 살리는 남북 단일팀,-2
경향신문,20180204, 사설 평화올림픽에 오는 아베 펜스의 비평화적 언행,-2
경향신문,20180205, 사설 북 김영남 방남  미국은 대화의 계기 놓치지 말아야,-1
경향신문,20180207, 사설 김여정의 평창올림픽 참석에 거는 기대,1
경향신문,20180208, 사설 규모 축소한 북한 열병식이 보내는 신호,-1
경향신문,20180209, 사설 김영남 피하려고  평창 리셉션  도중 빠져나간 펜스,0
경향신문,20180209, 사설 문재인 김여정 면담  대화의 문 활짝 열어야,-1
경향신문,20180211, 사설 김정은의 남북정상회담 제안을 환영한다,1
경향신문,20180211, 사설 아베 총리의 도 넘은 내정 간섭 발언을 규탄한다,1
경향신문,20180211, 김정은  방북 초청 중  문 대통령 시급한 과제는 미국 설득  환영 일  북   ,1
경향신문,20180212, 사설 시민 정치권이 한목소리 내야 평화가 온다,-2
경향신문,20180212, 박성진의 군 이야기  군 역사 바로 세우기  배경엔 정권의 정통성 강화 의   ,-1
경향신문,20180214, 사설 정부 개헌일정 확정  구경만 하는 국회,1
경향신문,20180218, 사설 문 대통령의 남북대화 속도조절  대화 모멘텀은 이어가야,-1
경향신문,20180219, 사설 문 대통령까지 나선 통상 문제  미국이 푸는 게 맞다,0
경향신문,20180220, 사설 통상에도 색깔론 들이대는 한국당  국익은 안중에도 없나,0
경향신문,20180221, 사설 아쉬운 펜스 김여정 만남 불발  하지만 기회는 더 있다,1
경향신문,20180222, 사설 북 김영철 리선권 방남  평창 이후를 준비해야,-1
경향신문,20180223, 사설 새누리당은 2014년에 왜 김영철을 환영했나,0
경향신문,20180225, 사설 한국당의 절망이 낳은 집단 광기,-1
경향신문,20180225, 사설 북 김영철의 북 미대화 용의 표명을 주목한다,-1
경향신문,20180226, 사설 양승동 KBS 새 사장 내정자에 바란다,1
경향신문,20180226, 사설 평화올림픽 끝나지 않았다  북 미는 대화의 장으로,-1
경향신문,20180228, 사설 대통령과 야당 대표 만날 때가 됐다,-1
경향신문,20180301, 사설  역사의 진실  마주하라는 문 대통령의 3 1절 기념사,1
경향신문,20180302, 사설 송영무 박상기 정현백 김상곤 강경화 최선을 다하고 있나,-1
경향신문,20180302, 사설 북 미대화 돌파구 여는 대북특사를 기대한다,-1
경향신문,20180304, 사설 44년 만에 연임하는 이주열 한은 총재의 과제,0
경향신문,20180304, 사설 정의용 서훈 대북 특사를 맞이하는 북한의 자세,1
경향신문,20180305, 사설 홍준표의 여야 대표 회동 참여를 환영한다,0
경향신문,20180306, 사설 문 대통령 성의에 놀라운 결단으로 화답한 김정은,0
경향신문,20180307, 사설 문 대통령 야당 대표 회동  안보협치의 출발점 돼야,0
경향신문,20180309, 사설 김정은 트럼프  역사를 바꾸는 정상회담을 바란다,1
경향신문,20180311, 사설 북 미 정상회담 성공하려면 중 일 러의 협력도 중요하다,2
경향신문,20180313, 사설 대통령 개헌안 발의는 최후의 수단  국회가 나서라,0
경향신문,20180315, 사설 청년실업  임기응변 아닌 근본책을 써야,0
경향신문,20180316, 사설 부정입사 전원 면직  모든 채용비리에 적용해야,-1
경향신문,20180316, 사설 완성된 개헌안 못 낸 한국당  여전히 모호한 당론,1
경향신문,20180318, 사설 평창 패럴림픽 성공이 의미하는 것,1
경향신문,20180319, 사설 개헌과 선거제 개혁에 대한 한국당 이중적 태도,0
경향신문,20180320, 사설 기본권 확대 개헌  이론의 여지가 없다,-1
경향신문,20180320, 사설 문 대통령은 베트남인 학살 사과해야 한다,-1
경향신문,20180321, 사설 시대적 요청을 반영한 지방분권 토지공개념 개헌,0
경향신문,20180321, 사설 남 북 미 정상회담의 성사를 기대한다,2
경향신문,20180322, 사설 분권과 정치개혁을 위한 개헌이 필요하다,1
경향신문,20180325, 사설 대통령 개헌안 발의  국회 끝까지 역사적 책임 외면할 텐가,0
경향신문,20180327, 사설 도시재생 사업이 전시 행정 되지 않으려면,1
경향신문,20180327, 사설 북 최고위급의 중국 방문을 주목한다,1
경향신문,20180328, 사설 단계적 조치하면 비핵화 해결된다는 김정은,-2
경향신문,20180328,중국  한 러에 특사 파견 한반도 정세  역할 확대  잰걸음,1
경향신문,20180329, 사설 현대차 순환출자 해소  삼성은 뭘 하고 있나,-1
경향신문,20180329, 사설 기득권에 집착하는 문무일 총장에게 묻는다,0
경향신문,20180401, 사설  의료를 멈추겠다 고 대국민 협박하는 의사협회,-1
경향신문,20180402, 사설 김정은의 남측 공연 관람  교류 활성화 계기로,-1
경향신문,20180403, 사설 70년 동안 4 3을 방치한 책임을 성찰한다,0
경향신문,20180404, 사설 일본도 한반도 평화에 기여할 줄 알아야 한다,-1
경향신문,20180404, 사설 국민투표법 방치한 국회  또 압박하는 청와대,0
경향신문,20180408, 사설 자유한국당은  박근혜 중형 이 잘못됐다고 생각하나,-1
경향신문,20180411, 사설 한 미연구소 논란과 폐쇄가 남긴 것,0
경향신문,20180412, 사설 이통 요금 원가 공개 판결  요금 인하로 이어져야,0
경향신문,20180413, 사설 문 대통령  홍준표 왜 만났나,0
경향신문,20180415, 사설 세월호 4주기  그리고 살아남은 자의 책무,0
경향신문,20180415, 사설 민주당원 댓글조작 사건  진상 철저히 밝혀라,0
경향신문,20180416, 사설 김기식 사태에서 청와대가 배워야 할 것,1
경향신문,20180416, 사설 여론조작 뿌리 뽑는 사이버 정화 운동을,0
경향신문,20180418,권오준 결국 사퇴 포스코 회장들 정권 바뀌면 중도하차,1
경향신문,20180419, 사설 완전한 비핵화 가능성 보이는 북 미 정상회담,0
경향신문,20180420, 사설 장애인 고용 기피  정부부터 바로잡아야,-2
경향신문,20180420, 사설 남북 정상 간 핫라인 개통이 의미하는 것,1
경향신문,20180420, 드루킹 사건  매크로 정황  6건 추가 정치 경제 사회 기사 망라,1
경향신문,20180422, 사설 비핵화 기대 높인 북한의 핵 미사일 실험 중지 조치,-1
경향신문,20180424, 사설 한반도 평화를 향한 4개월 여정을 돌아보며,-1
경향신문,20180424, 사설 국민투표 무산  개헌 기회 차버린 야당,0
경향신문,20180425, 사설 여전한 비정규직 임금 격차,1
경향신문,20180425, 사설 지방선거에 지방이 없다,-1
경향신문,20180426, 사설 70년 대결의 시대를 넘어 평화의 시대로,-1
경향신문,20180427, 사설  결코 뒤돌아가지 않겠다 는 남북 정상의 불가역적 합의,1
경향신문,20180427, 사설 핵 없는 한반도와 평화의 위대한 여정을 시작하다,1
경향신문,20180429, 사설 완전한 비핵화를 위한 북 미 정상의 결단을 바라며,-1
경향신문,20180430, 사설 한국당의 국회 비준 거부 이유를 알고 싶다,0
경향신문,20180501, 사설 남북 확성기 철거  판문점선언 착실한 이행이 중요하다,2
경향신문,20180501, 사설  판문점 북 미 정상회담   트럼프 김정은의 결단을 기대하며,2
경향신문,20180501, 사설 노동절에 다시 확인된 노동자의 슬픈 현실,-1
경향신문,20180502, 사설 초당협력으로 트럼프의 대북정책 지지한 미 의회,-1
경향신문,20180502, 사설 평화협정 이후 주한미군에 관한 생산적 논의를,-1
경향신문,20180504, 사설 긴밀한 소통과 공조 다짐한 한 중 정상 간 통화,-1
경향신문,20180504, 사설 윤석헌 신임 금감원장 어깨 위에 놓인 과제들,0
경향신문,20180507, 사설 북 미 난기류 조짐  더 중요해진 한 미 정상회담,-1
경향신문,20180508, 사설 6년 만의 대통령 방일  평화 촉진하는 한 일관계로,-1
경향신문,20180509, 사설 문재인 정부 1년  경제와 협치에서도 성과 보여라,1
